thai,romanization,english,breakdown,difficulty
ฉันแทบจะไม่ได้ยิน,chan thaep cha mai dai yin,I could barely hear.,"[{""thai"":""ฉัน"",""english"":""I"",""tones"":[""rising""],""tone"":""rising"",""romanization"":""chǎn""},{""thai"":""แทบจะ"",""english"":""barely / almost not"",""tones"":[""falling"",""low""],""grammar"":true,""romanization"":""thâep jà""},{""thai"":""ไม่ได้ยิน"",""english"":""barely hear / cannot hear"",""romanization"":""mâi dâai yin""}]",easy
เขาแทบจะไม่ได้นอน,khao thaep cha mai dai non,He barely slept.,"[{""thai"":""เขา"",""english"":""he / she"",""tones"":[""rising""],""tone"":""rising"",""romanization"":""khǎo""},{""thai"":""แทบจะ"",""english"":""barely / almost not"",""tones"":[""falling"",""low""],""grammar"":true,""romanization"":""thâep jà""},{""thai"":""ไม่ได้นอน"",""english"":""barely sleep / did not sleep"",""romanization"":""mâi dâai non""}]",easy
เขาแทบจะไม่ได้กินข้าวเช้า,khǎo thâep jà mâi dâai gin khâao cháo,He barely had breakfast.,"[{""thai"":""เขา"",""english"":""he"",""tones"":[""rising""],""tone"":""rising"",""romanization"":""khǎo""},{""thai"":""แทบจะ"",""english"":""barely"",""tones"":[""falling"",""low""],""grammar"":true,""romanization"":""thâep jà""},{""thai"":""ไม่ได้"",""english"":""did not"",""tones"":[""falling"",""falling""],""romanization"":""mâi dâai""},{""thai"":""กิน"",""english"":""eat"",""tones"":[""mid""],""tone"":""mid"",""romanization"":""gin""},{""thai"":""ข้าวเช้า"",""english"":""breakfast"",""tones"":[""falling"",""high""],""romanization"":""khâao cháo""}]",easy
ฝนตกหนักจนเราแทบจะไม่ได้ยินเสียงกัน,fǒn tòk nàk jon rao thâep jà mâi dâai yin sǐiang gan,The rain was so heavy that we could barely hear each other.,"[{""thai"":""ฝนตกหนัก"",""english"":""heavy rain"",""tones"":[""rising"",""low"",""low""],""romanization"":""fǒn tòk nàk""},{""thai"":""จน"",""english"":""that"",""romanization"":""jon""},{""thai"":""เรา"",""english"":""we"",""romanization"":""rao""},{""thai"":""แทบจะ"",""english"":""barely"",""tones"":[""falling"",""low""],""grammar"":true,""romanization"":""thâep jà""},{""thai"":""ไม่ได้ยิน"",""english"":""could not hear"",""romanization"":""mâi dâai yin""},{""thai"":""เสียงกัน"",""english"":""each other"",""romanization"":""sǐiang gan""}]",medium
เธอแทบจะไม่ผ่านการสอบ,thoe thâep jà mâi phàan gaan sòp,She barely passed the exam.,"[{""thai"":""เธอ"",""english"":""she"",""tones"":[""mid""],""tone"":""mid"",""romanization"":""thoe""},{""thai"":""แทบจะ"",""english"":""barely"",""tones"":[""falling"",""low""],""grammar"":true,""romanization"":""thâep jà""},{""thai"":""ไม่"",""english"":""not"",""tones"":[""falling""],""tone"":""falling"",""romanization"":""mâi""},{""thai"":""ผ่าน"",""english"":""pass"",""tones"":[""low""],""tone"":""low"",""romanization"":""phàan""},{""thai"":""การสอบ"",""english"":""the exam"",""romanization"":""gaan sòp""}]",easy
เขาเหนื่อยมากจนแทบจะลุกไม่ขึ้น,khǎo nùeai mâak jon thâep jà lúk mâi khûen,He was so tired that he could barely stand up.,"[{""thai"":""เขา"",""english"":""he"",""tones"":[""rising""],""tone"":""rising"",""romanization"":""khǎo""},{""thai"":""เหนื่อยมาก"",""english"":""very tired"",""tones"":[""low"",""falling""],""romanization"":""nùeai mâak""},{""thai"":""จน"",""english"":""that"",""romanization"":""jon""},{""thai"":""แทบจะ"",""english"":""barely"",""tones"":[""falling"",""low""],""grammar"":true,""romanization"":""thâep jà""},{""thai"":""ลุก"",""english"":""stand up"",""tones"":[""high""],""tone"":""high"",""romanization"":""lúk""},{""thai"":""ไม่ขึ้น"",""english"":""could not"",""tones"":[""falling"",""falling""],""romanization"":""mâi khûen""}]",medium
เขาตื่นสายจึงแทบจะไม่ทันรถเมล์,khǎo tǔen sǎai jeung thâep jà mâi than rót mee,He woke up late and barely caught the bus.,"[{""thai"":""เขา"",""english"":""he"",""tones"":[""rising""],""tone"":""rising"",""romanization"":""khǎo""},{""thai"":""ตื่นสาย"",""english"":""woke up late"",""tones"":[""rising"",""rising""],""romanization"":""tǔen sǎai""},{""thai"":""จึง"",""english"":""and"",""tones"":[""mid""],""tone"":""mid"",""romanization"":""jeung""},{""thai"":""แทบจะ"",""english"":""barely"",""tones"":[""falling"",""low""],""grammar"":true,""romanization"":""thâep jà""},{""thai"":""ไม่ทัน"",""english"":""did not catch"",""romanization"":""mâi than""},{""thai"":""รถเมล์"",""english"":""the bus"",""romanization"":""rót mee""}]",medium
เราแทบจะรอไม่ไหวแล้ว,rao thâep jà ror mâi wǎi laeo,We can barely wait anymore.,"[{""thai"":""เรา"",""english"":""we"",""romanization"":""rao""},{""thai"":""แทบจะ"",""english"":""barely"",""tones"":[""falling"",""low""],""grammar"":true,""romanization"":""thâep jà""},{""thai"":""รอไม่ไหว"",""english"":""cannot wait"",""romanization"":""ror mâi wǎi""},{""thai"":""แล้ว"",""english"":""anymore"",""tones"":[""high""],""tone"":""high"",""romanization"":""laeo""}]",easy
เขาแทบจะไม่เข้าใจสิ่งที่อาจารย์อธิบาย,khǎo thâep jà mâi khâo-jai sìng thîi àajaan à-thí-baai,He could barely understand what the teacher explained.,"[{""thai"":""เขา"",""english"":""he"",""tones"":[""rising""],""tone"":""rising"",""romanization"":""khǎo""},{""thai"":""แทบจะ"",""english"":""barely"",""tones"":[""falling"",""low""],""grammar"":true,""romanization"":""thâep jà""},{""thai"":""ไม่เข้าใจ"",""english"":""did not understand"",""romanization"":""mâi khâo-jai""},{""thai"":""สิ่งที่"",""english"":""what"",""tones"":[""low"",""falling""],""romanization"":""sìng thîi""},{""thai"":""อาจารย์"",""english"":""teacher"",""tones"":[""low""],""tone"":""low"",""romanization"":""àajaan""},{""thai"":""อธิบาย"",""english"":""explained"",""romanization"":""à-thí-baai""}]",hard
ฉันแทบจะไม่เชื่อสิ่งที่เธอพูด,chǎn thâep jà mâi chêuua sìng thîi thoe phût,I could barely believe what she said.,"[{""thai"":""ฉัน"",""english"":""I"",""tones"":[""rising""],""tone"":""rising"",""romanization"":""chǎn""},{""thai"":""แทบจะ"",""english"":""barely"",""tones"":[""falling"",""low""],""grammar"":true,""romanization"":""thâep jà""},{""thai"":""ไม่เชื่อ"",""english"":""did not believe"",""tones"":[""falling"",""falling""],""romanization"":""mâi chêuua""},{""thai"":""สิ่งที่"",""english"":""what"",""tones"":[""low"",""falling""],""romanization"":""sìng thîi""},{""thai"":""เธอ"",""english"":""she"",""tones"":[""mid""],""tone"":""mid"",""romanization"":""thoe""},{""thai"":""พูด"",""english"":""said"",""tones"":[""falling""],""tone"":""falling"",""romanization"":""phût""}]",hard
ฝนตกหนักตลอดทางทำให้แทบจะมองไม่เห็นถนน,fǒn tòk nàk talòt thaang tham-hâi thâep jà maawng mâi hěn thanǒn,The rain was so heavy all the way that we could barely see the road.,"[{""thai"":""ฝนตกหนัก"",""english"":""heavy rain"",""tones"":[""rising"",""low"",""low""],""romanization"":""fǒn tòk nàk""},{""thai"":""ตลอดทาง"",""english"":""all the way"",""romanization"":""talòt thaang""},{""thai"":""ทำให้"",""english"":""make"",""romanization"":""tham-hâi""},{""thai"":""แทบจะ"",""english"":""barely"",""tones"":[""falling"",""low""],""grammar"":true,""romanization"":""thâep jà""},{""thai"":""มองไม่เห็น"",""english"":""could not see"",""romanization"":""maawng mâi hěn""},{""thai"":""ถนน"",""english"":""the road"",""tones"":[""rising""],""tone"":""rising"",""romanization"":""thanǒn""}]",hard
เขาแทบจะไม่มีเวลาให้ตัวเอง,khǎo thâep jà mâi mee wèelaa hâi tua-eeng,He barely has time for himself.,"[{""thai"":""เขา"",""english"":""he"",""tones"":[""rising""],""tone"":""rising"",""romanization"":""khǎo""},{""thai"":""แทบจะ"",""english"":""barely"",""tones"":[""falling"",""low""],""grammar"":true,""romanization"":""thâep jà""},{""thai"":""ไม่มีเวลา"",""english"":""has no time"",""romanization"":""mâi mee wèelaa""},{""thai"":""ให้ตัวเอง"",""english"":""for himself"",""romanization"":""hâi tua-eeng""}]",medium
ฉันแทบจะไม่สามารถทำงานนี้ให้เสร็จในวันนี้,chǎn thâep jà mâi sǎamaat tham-ngaan níi hâi sèt nai wan-níi,I can barely finish this work today.,"[{""thai"":""ฉัน"",""english"":""I"",""tones"":[""rising""],""tone"":""rising"",""romanization"":""chǎn""},{""thai"":""แทบจะ"",""english"":""barely"",""tones"":[""falling"",""low""],""grammar"":true,""romanization"":""thâep jà""},{""thai"":""ไม่สามารถ"",""english"":""cannot"",""tones"":[""falling"",""rising""],""romanization"":""mâi sǎamaat""},{""thai"":""ทำงานนี้"",""english"":""finish this work"",""romanization"":""tham-ngaan níi""},{""thai"":""ให้เสร็จ"",""english"":""to completion"",""tones"":[""falling"",""low""],""romanization"":""hâi sèt""},{""thai"":""ในวันนี้"",""english"":""today"",""romanization"":""nai wan-níi""}]",hard
รถติดมากทำให้เราแทบจะไม่ได้ไปถึงสนามบิน,rót tìt mâak tham-hâi rao thâep jà mâi dâai pai thǔeng sanǎam-bin,The traffic was so bad that we barely reached the airport.,"[{""thai"":""รถติดมาก"",""english"":""traffic was very bad"",""tones"":[""high"",""low"",""falling""],""romanization"":""rót tìt mâak""},{""thai"":""ทำให้"",""english"":""make"",""romanization"":""tham-hâi""},{""thai"":""เรา"",""english"":""we"",""romanization"":""rao""},{""thai"":""แทบจะ"",""english"":""barely"",""tones"":[""falling"",""low""],""grammar"":true,""romanization"":""thâep jà""},{""thai"":""ไม่ได้ไปถึง"",""english"":""did not reach"",""romanization"":""mâi dâai pai thǔeng""},{""thai"":""สนามบิน"",""english"":""the airport"",""romanization"":""sanǎam-bin""}]",hard
เขาแทบจะไม่ได้ยินเสียงเพลงในคอนเสิร์ต,khǎo thâep jà mâi dâai yin sǐiang phleeng nai khon-sèet,He could barely hear the music at the concert.,"[{""thai"":""เขา"",""english"":""he"",""tones"":[""rising""],""tone"":""rising"",""romanization"":""khǎo""},{""thai"":""แทบจะ"",""english"":""barely"",""tones"":[""falling"",""low""],""grammar"":true,""romanization"":""thâep jà""},{""thai"":""ไม่ได้ยิน"",""english"":""could not hear"",""romanization"":""mâi dâai yin""},{""thai"":""เสียงเพลง"",""english"":""the music"",""romanization"":""sǐiang phleeng""},{""thai"":""ในคอนเสิร์ต"",""english"":""at the concert"",""romanization"":""nai khon-sèet""}]",medium
ฉันแทบจะไม่รู้ว่าจะเลือกอะไร,chǎn thâep jà mâi róo wâa jà lûeak àrai,I barely know what to choose.,"[{""thai"":""ฉัน"",""english"":""I"",""tones"":[""rising""],""tone"":""rising"",""romanization"":""chǎn""},{""thai"":""แทบจะ"",""english"":""barely"",""tones"":[""falling"",""low""],""grammar"":true,""romanization"":""thâep jà""},{""thai"":""ไม่รู้ว่า"",""english"":""do not know"",""tones"":[""falling"",""high"",""falling""],""romanization"":""mâi róo wâa""},{""thai"":""จะเลือก"",""english"":""to choose"",""tones"":[""low"",""falling""],""romanization"":""jà lûeak""},{""thai"":""อะไร"",""english"":""what"",""tones"":[""low""],""tone"":""low"",""romanization"":""àrai""}]",medium
เขาแทบจะไม่ได้กลับบ้านในช่วงนี้,khǎo thâep jà mâi dâai klàp bâan nai chûuang níi,He barely comes home these days.,"[{""thai"":""เขา"",""english"":""he"",""tones"":[""rising""],""tone"":""rising"",""romanization"":""khǎo""},{""thai"":""แทบจะ"",""english"":""barely"",""tones"":[""falling"",""low""],""grammar"":true,""romanization"":""thâep jà""},{""thai"":""ไม่ได้กลับ"",""english"":""does not come"",""tones"":[""falling"",""falling"",""low""],""romanization"":""mâi dâai klàp""},{""thai"":""บ้าน"",""english"":""home"",""tones"":[""falling""],""tone"":""falling"",""romanization"":""bâan""},{""thai"":""ในช่วงนี้"",""english"":""these days"",""romanization"":""nai chûuang níi""}]",medium
เราแทบจะไม่พร้อมที่จะไป,rao thâep jà mâi phráawm thîi jà pai,We are barely ready to go.,"[{""thai"":""เรา"",""english"":""we"",""romanization"":""rao""},{""thai"":""แทบจะ"",""english"":""barely"",""tones"":[""falling"",""low""],""grammar"":true,""romanization"":""thâep jà""},{""thai"":""ไม่พร้อม"",""english"":""not ready"",""tones"":[""falling"",""high""],""romanization"":""mâi phráawm""},{""thai"":""ที่จะ"",""english"":""to"",""tones"":[""falling"",""low""],""romanization"":""thîi jà""},{""thai"":""ไป"",""english"":""go"",""tones"":[""mid""],""tone"":""mid"",""romanization"":""pai""}]",easy
เธอแทบจะไม่เชื่อสิ่งที่เกิดขึ้น,thoe thâep jà mâi chêuua sìng thîi gèrt khûn,She could barely believe what happened.,"[{""thai"":""เธอ"",""english"":""she"",""tones"":[""mid""],""tone"":""mid"",""romanization"":""thoe""},{""thai"":""แทบจะ"",""english"":""barely"",""tones"":[""falling"",""low""],""grammar"":true,""romanization"":""thâep jà""},{""thai"":""ไม่เชื่อ"",""english"":""did not believe"",""tones"":[""falling"",""falling""],""romanization"":""mâi chêuua""},{""thai"":""สิ่งที่"",""english"":""what"",""tones"":[""low"",""falling""],""romanization"":""sìng thîi""},{""thai"":""เกิดขึ้น"",""english"":""happened"",""tones"":[""low"",""falling""],""romanization"":""gèrt khûn""}]",hard
ฉันแทบจะไม่ได้ไปวิ่งตอนเช้าในช่วงนี้,chǎn thâep jà mâi dâai pai wîng ton cháo nai chûuang níi,I barely go running in the morning these days.,"[{""thai"":""ฉัน"",""english"":""I"",""tones"":[""rising""],""tone"":""rising"",""romanization"":""chǎn""},{""thai"":""แทบจะ"",""english"":""barely"",""tones"":[""falling"",""low""],""grammar"":true,""romanization"":""thâep jà""},{""thai"":""ไม่ได้ไปวิ่ง"",""english"":""do not go running"",""romanization"":""mâi dâai pai wîng""},{""thai"":""ตอนเช้า"",""english"":""in the morning"",""romanization"":""ton cháo""},{""thai"":""ในช่วงนี้"",""english"":""these days"",""romanization"":""nai chûuang níi""}]",medium
เขาแทบจะไม่กินผักเลย,khǎo thâep jà mâi gin phàk loei,He barely eats vegetables.,"[{""thai"":""เขา"",""english"":""he"",""tones"":[""rising""],""tone"":""rising"",""romanization"":""khǎo""},{""thai"":""แทบจะ"",""english"":""barely"",""tones"":[""falling"",""low""],""grammar"":true,""romanization"":""thâep jà""},{""thai"":""ไม่กิน"",""english"":""does not eat"",""romanization"":""mâi gin""},{""thai"":""ผัก"",""english"":""vegetables"",""tones"":[""low""],""tone"":""low"",""romanization"":""phàk""},{""thai"":""เลย"",""english"":""at all"",""tones"":[""mid""],""tone"":""mid"",""romanization"":""loei""}]",easy
เขาแทบจะไม่ได้พักผ่อนเพราะงานยุ่งมาก,khǎo thâep jà mâi dâai phák-phàwn phráw ngaan yûng mâak,He barely has time to rest because he is very busy with work.,"[{""thai"":""เขา"",""english"":""he"",""tones"":[""rising""],""tone"":""rising"",""romanization"":""khǎo""},{""thai"":""แทบจะ"",""english"":""barely"",""tones"":[""falling"",""low""],""grammar"":true,""romanization"":""thâep jà""},{""thai"":""ไม่ได้พักผ่อน"",""english"":""does not have time to rest"",""tones"":[""falling"",""falling"",""high"",""low""],""romanization"":""mâi dâai phák-phàwn""},{""thai"":""เพราะ"",""english"":""because"",""tones"":[""high""],""tone"":""high"",""romanization"":""phráw""},{""thai"":""งานยุ่งมาก"",""english"":""very busy with work"",""romanization"":""ngaan yûng mâak""}]",hard
เราแทบจะไม่ได้คุยกัน,rao thâep jà mâi dâai khui gan,We barely talk to each other.,"[{""thai"":""เรา"",""english"":""we"",""romanization"":""rao""},{""thai"":""แทบจะ"",""english"":""barely"",""tones"":[""falling"",""low""],""grammar"":true,""romanization"":""thâep jà""},{""thai"":""ไม่ได้"",""english"":""do not"",""tones"":[""falling"",""falling""],""romanization"":""mâi dâai""},{""thai"":""คุยกัน"",""english"":""talk to each other"",""romanization"":""khui gan""}]",easy
ฝนตกหนักมากจนแทบจะเดินไม่ได้,fǒn tòk nàk mâak jon thâep jà doen mâi dâai,The rain was so heavy that I could barely walk.,"[{""thai"":""ฝนตกหนักมาก"",""english"":""very heavy rain"",""tones"":[""rising"",""low"",""low"",""falling""],""romanization"":""fǒn tòk nàk mâak""},{""thai"":""จน"",""english"":""that"",""romanization"":""jon""},{""thai"":""แทบจะ"",""english"":""barely"",""tones"":[""falling"",""low""],""grammar"":true,""romanization"":""thâep jà""},{""thai"":""เดินไม่ได้"",""english"":""could not walk"",""romanization"":""doen mâi dâai""}]",hard
เขาแทบจะไม่ได้พูดอะไรเลยในที่ประชุม,khǎo thâep jà mâi dâai phût à-rai loei nai thîi prachum,He barely said anything in the meeting.,"[{""thai"":""เขา"",""english"":""he"",""tones"":[""rising""],""tone"":""rising"",""romanization"":""khǎo""},{""thai"":""แทบจะ"",""english"":""barely"",""tones"":[""falling"",""low""],""grammar"":true,""romanization"":""thâep jà""},{""thai"":""ไม่ได้พูด"",""english"":""did not say"",""tones"":[""falling"",""falling"",""falling""],""romanization"":""mâi dâai phût""},{""thai"":""อะไรเลย"",""english"":""anything"",""romanization"":""à-rai loei""},{""thai"":""ในที่ประชุม"",""english"":""in the meeting"",""romanization"":""nai thîi prachum""}]",medium
ฉันแทบจะไม่ได้ยิน,chǎn thâep jà mâi dâai yin,I could barely hear.,"[{""thai"":""ฉัน"",""english"":""I"",""tones"":[""rising""],""tone"":""rising"",""romanization"":""chǎn""},{""thai"":""แทบจะ"",""english"":""barely / almost not"",""tones"":[""falling"",""low""],""grammar"":true,""romanization"":""thâep jà""},{""thai"":""ไม่ได้ยิน"",""english"":""couldn't hear"",""tones"":[""falling"",""falling"",""mid""],""romanization"":""mâi dâai yin""}]",easy
เขาแทบจะไม่ได้นอน,khǎo thâep jà mâi dâai nawn,He barely slept.,"[{""thai"":""เขา"",""english"":""he"",""tones"":[""rising""],""tone"":""rising"",""romanization"":""khǎo""},{""thai"":""แทบจะ"",""english"":""barely / almost not"",""tones"":[""falling"",""low""],""grammar"":true,""romanization"":""thâep jà""},{""thai"":""ไม่ได้นอน"",""english"":""didn't get to sleep"",""tones"":[""falling"",""falling"",""mid""],""romanization"":""mâi dâai nawn""}]",easy
เราแทบจะมองไม่เห็น,rao thâep jà maawng mâi hěn,We could barely see.,"[{""thai"":""เรา"",""english"":""we"",""tones"":[""mid""],""tone"":""mid"",""romanization"":""rao""},{""thai"":""แทบจะ"",""english"":""barely"",""tones"":[""falling"",""low""],""grammar"":true,""romanization"":""thâep jà""},{""thai"":""มองไม่เห็น"",""english"":""could barely see"",""tones"":[""mid"",""falling"",""rising""],""romanization"":""maawng mâi hěn""}]",easy
เธอแทบจะไม่มีเวลาเลย,thoe thâep jà mâi mii wee-laa loei,She barely has any time at all.,"[{""thai"":""เธอ"",""english"":""she"",""tones"":[""mid""],""tone"":""mid"",""romanization"":""thoe""},{""thai"":""แทบจะ"",""english"":""barely"",""tones"":[""falling"",""low""],""grammar"":true,""romanization"":""thâep jà""},{""thai"":""ไม่มีเวลาเลย"",""english"":""has hardly any time at all"",""tones"":[""falling"",""mid"",""mid"",""mid"",""mid""],""romanization"":""mâi mii wee-laa loei""}]",easy
พ่อแทบจะไม่ได้พัก,phâw thâep jà mâi dâai phák,Dad barely got any rest.,"[{""thai"":""พ่อ"",""english"":""Dad"",""tones"":[""falling""],""tone"":""falling"",""romanization"":""phâw""},{""thai"":""แทบจะ"",""english"":""barely"",""tones"":[""falling"",""low""],""grammar"":true,""romanization"":""thâep jà""},{""thai"":""ไม่ได้พัก"",""english"":""didn't get to rest"",""tones"":[""falling"",""falling"",""high""],""romanization"":""mâi dâai phák""}]",easy
แม่แทบจะยืนไม่ไหว,mâe thâep jà yʉʉn mâi wǎi,Mom could barely stand.,"[{""thai"":""แม่"",""english"":""Mom"",""tones"":[""falling""],""tone"":""falling"",""romanization"":""mâe""},{""thai"":""แทบจะ"",""english"":""barely"",""tones"":[""falling"",""low""],""grammar"":true,""romanization"":""thâep jà""},{""thai"":""ยืนไม่ไหว"",""english"":""could hardly stand"",""tones"":[""mid"",""falling"",""rising""],""romanization"":""yʉʉn mâi wǎi""}]",easy
ฉันแทบจะจำชื่อเขาไม่ได้,chǎn thâep jà jam chʉ̂ʉ khǎo mâi dâai,I could barely remember his name.,"[{""thai"":""ฉัน"",""english"":""I"",""tones"":[""rising""],""tone"":""rising"",""romanization"":""chǎn""},{""thai"":""แทบจะ"",""english"":""barely"",""tones"":[""falling"",""low""],""grammar"":true,""romanization"":""thâep jà""},{""thai"":""จำชื่อเขาไม่ได้"",""english"":""could barely remember his name"",""tones"":[""mid"",""falling"",""rising"",""falling"",""falling""],""romanization"":""jam chʉ̂ʉ khǎo mâi dâai""}]",medium
เขาแทบจะกินอะไรไม่ได้,khǎo thâep jà gin à-rai mâi dâai,He could barely eat anything.,"[{""thai"":""เขา"",""english"":""he"",""tones"":[""rising""],""tone"":""rising"",""romanization"":""khǎo""},{""thai"":""แทบจะ"",""english"":""barely"",""tones"":[""falling"",""low""],""grammar"":true,""romanization"":""thâep jà""},{""thai"":""กินอะไรไม่ได้"",""english"":""could barely eat anything"",""tones"":[""mid"",""low"",""mid"",""falling"",""falling""],""romanization"":""gin à-rai mâi dâai""}]",medium
เราแทบจะเปิดประตูไม่ออก,rao thâep jà bpə̀ət prà-tuu mâi àawk,We could barely get the door open.,"[{""thai"":""เรา"",""english"":""we"",""tones"":[""mid""],""tone"":""mid"",""romanization"":""rao""},{""thai"":""แทบจะ"",""english"":""barely"",""tones"":[""falling"",""low""],""grammar"":true,""romanization"":""thâep jà""},{""thai"":""เปิดประตูไม่ออก"",""english"":""could barely open the door"",""tones"":[""low"",""low"",""mid"",""falling"",""low""],""romanization"":""bpə̀ət prà-tuu mâi àawk""}]",medium
เด็กแทบจะลืมตาไม่ขึ้น,dèk thâep jà lʉʉm-dtaa mâi khʉ̂n,The child could barely keep their eyes open.,"[{""thai"":""เด็ก"",""english"":""child"",""tones"":[""low""],""tone"":""low"",""romanization"":""dèk""},{""thai"":""แทบจะ"",""english"":""barely"",""tones"":[""falling"",""low""],""grammar"":true,""romanization"":""thâep jà""},{""thai"":""ลืมตาไม่ขึ้น"",""english"":""could barely keep the eyes open"",""tones"":[""mid"",""mid"",""falling"",""falling""],""romanization"":""lʉʉm-dtaa mâi khʉ̂n""}]",medium
ฉันแทบจะพูดไม่ออก,chǎn thâep jà phûut mâi àawk,I could barely speak.,"[{""thai"":""ฉัน"",""english"":""I"",""tones"":[""rising""],""tone"":""rising"",""romanization"":""chǎn""},{""thai"":""แทบจะ"",""english"":""barely"",""tones"":[""falling"",""low""],""grammar"":true,""romanization"":""thâep jà""},{""thai"":""พูดไม่ออก"",""english"":""could barely speak"",""tones"":[""falling"",""falling"",""low""],""romanization"":""phûut mâi àawk""}]",easy
