thai,romanization,english,breakdown,difficulty
เขาแทบจะไม่มีเงินเลย,khǎo thâep jà mâi mii ngoen loei,He has almost no money at all.,"[{""thai"":""เขา"",""english"":""he"",""tones"":[""rising""],""tone"":""rising"",""romanization"":""khǎo""},{""thai"":""แทบจะ"",""english"":""almost / barely"",""tones"":[""falling"",""low""],""grammar"":true,""romanization"":""thâep jà""},{""thai"":""ไม่มีเงินเลย"",""english"":""has almost no money"",""tones"":[""falling"",""mid"",""mid"",""mid""],""romanization"":""mâi mii ngoen loei""}]",easy
เราแทบจะไปไม่ทัน,rao thâep jà bpai mâi than,We barely made it in time.,"[{""thai"":""เรา"",""english"":""we"",""tones"":[""mid""],""tone"":""mid"",""romanization"":""rao""},{""thai"":""แทบจะ"",""english"":""barely"",""tones"":[""falling"",""low""],""grammar"":true,""romanization"":""thâep jà""},{""thai"":""ไปไม่ทัน"",""english"":""barely made it in time"",""tones"":[""mid"",""falling"",""mid""],""romanization"":""bpai mâi than""}]",easy
เธอแทบจะยกกล่องไม่ไหว,thoe thâep jà yók glòng mâi wǎi,She could barely lift the box.,"[{""thai"":""เธอ"",""english"":""she"",""tones"":[""mid""],""tone"":""mid"",""romanization"":""thoe""},{""thai"":""แทบจะ"",""english"":""barely"",""tones"":[""falling"",""low""],""grammar"":true,""romanization"":""thâep jà""},{""thai"":""ยกกล่องไม่ไหว"",""english"":""could barely lift the box"",""tones"":[""high"",""low"",""falling"",""rising""],""romanization"":""yók glòng mâi wǎi""}]",medium
พ่อแทบจะมองจอไม่เห็น,phâw thâep jà maawng jaaw mâi hěn,Dad could barely see the screen.,"[{""thai"":""พ่อ"",""english"":""Dad"",""tones"":[""falling""],""tone"":""falling"",""romanization"":""phâw""},{""thai"":""แทบจะ"",""english"":""barely"",""tones"":[""falling"",""low""],""grammar"":true,""romanization"":""thâep jà""},{""thai"":""มองจอไม่เห็น"",""english"":""could barely see the screen"",""tones"":[""mid"",""mid"",""falling"",""rising""],""romanization"":""maawng jaaw mâi hěn""}]",medium
แม่แทบจะเดินต่อไม่ไหว,mâe thâep jà dəən dtàaw mâi wǎi,Mom could barely keep walking.,"[{""thai"":""แม่"",""english"":""Mom"",""tones"":[""falling""],""tone"":""falling"",""romanization"":""mâe""},{""thai"":""แทบจะ"",""english"":""barely"",""tones"":[""falling"",""low""],""grammar"":true,""romanization"":""thâep jà""},{""thai"":""เดินต่อไม่ไหว"",""english"":""could barely keep walking"",""tones"":[""mid"",""low"",""falling"",""rising""],""romanization"":""dəən dtàaw mâi wǎi""}]",medium
ฉันแทบจะไม่มีแรงแล้ว,chǎn thâep jà mâi mii raaeng láaeo,I have almost no energy left.,"[{""thai"":""ฉัน"",""english"":""I"",""tones"":[""rising""],""tone"":""rising"",""romanization"":""chǎn""},{""thai"":""แทบจะ"",""english"":""almost / barely"",""tones"":[""falling"",""low""],""grammar"":true,""romanization"":""thâep jà""},{""thai"":""ไม่มีแรงแล้ว"",""english"":""have almost no energy left"",""tones"":[""falling"",""mid"",""mid"",""high""],""romanization"":""mâi mii raaeng láaeo""}]",easy
เขาแทบจะตอบไม่ได้,khǎo thâep jà dtàwp mâi dâai,He could barely answer.,"[{""thai"":""เขา"",""english"":""he"",""tones"":[""rising""],""tone"":""rising"",""romanization"":""khǎo""},{""thai"":""แทบจะ"",""english"":""barely"",""tones"":[""falling"",""low""],""grammar"":true,""romanization"":""thâep jà""},{""thai"":""ตอบไม่ได้"",""english"":""could barely answer"",""tones"":[""low"",""falling"",""falling""],""romanization"":""dtàwp mâi dâai""}]",easy
เราแทบจะหาที่นั่งไม่เจอ,rao thâep jà hǎa thîi-nâng mâi jəə,We could barely find a place to sit.,"[{""thai"":""เรา"",""english"":""we"",""tones"":[""mid""],""tone"":""mid"",""romanization"":""rao""},{""thai"":""แทบจะ"",""english"":""barely"",""tones"":[""falling"",""low""],""grammar"":true,""romanization"":""thâep jà""},{""thai"":""หาที่นั่งไม่เจอ"",""english"":""could barely find a seat"",""tones"":[""rising"",""falling"",""falling"",""falling"",""mid""],""romanization"":""hǎa thîi-nâng mâi jəə""}]",medium
เธอแทบจะฟังไม่ทัน,thoe thâep jà fang mâi than,She could barely follow what she was hearing.,"[{""thai"":""เธอ"",""english"":""she"",""tones"":[""mid""],""tone"":""mid"",""romanization"":""thoe""},{""thai"":""แทบจะ"",""english"":""barely"",""tones"":[""falling"",""low""],""grammar"":true,""romanization"":""thâep jà""},{""thai"":""ฟังไม่ทัน"",""english"":""could barely follow / hear in time"",""tones"":[""mid"",""falling"",""mid""],""romanization"":""fang mâi than""}]",easy
ฉันแทบจะไม่ได้กินข้าวเช้า,chǎn thâep jà mâi dâai gin khâao cháo,I barely had breakfast.,"[{""thai"":""ฉัน"",""english"":""I"",""tones"":[""rising""],""tone"":""rising"",""romanization"":""chǎn""},{""thai"":""แทบจะ"",""english"":""barely"",""tones"":[""falling"",""low""],""grammar"":true,""romanization"":""thâep jà""},{""thai"":""ไม่ได้กินข้าวเช้า"",""english"":""barely got to eat breakfast"",""tones"":[""falling"",""falling"",""mid"",""falling"",""high""],""romanization"":""mâi dâai gin khâao cháo""}]",easy
เขาแทบจะหยุดรถไม่ทัน,khǎo thâep jà yùt rót mâi than,He barely stopped the car in time.,"[{""thai"":""เขา"",""english"":""he"",""tones"":[""rising""],""tone"":""rising"",""romanization"":""khǎo""},{""thai"":""แทบจะ"",""english"":""barely"",""tones"":[""falling"",""low""],""grammar"":true,""romanization"":""thâep jà""},{""thai"":""หยุดรถไม่ทัน"",""english"":""barely stopped the car in time"",""tones"":[""low"",""high"",""falling"",""mid""],""romanization"":""yùt rót mâi than""}]",medium
รถคันนี้แทบจะไม่มีที่ว่าง,rót khan níi thâep jà mâi mii thîi wâang,This car has almost no space left.,"[{""thai"":""รถคันนี้"",""english"":""this car"",""tones"":[""high"",""mid"",""high""],""romanization"":""rót khan níi""},{""thai"":""แทบจะ"",""english"":""almost / barely"",""tones"":[""falling"",""low""],""grammar"":true,""romanization"":""thâep jà""},{""thai"":""ไม่มีที่ว่าง"",""english"":""has almost no free space"",""tones"":[""falling"",""mid"",""falling"",""falling""],""romanization"":""mâi mii thîi wâang""}]",medium
วันนี้ฉันแทบจะไม่ได้คุยกับใคร,wan-níi chǎn thâep jà mâi dâai khui gàp khrai,I barely talked to anyone today.,"[{""thai"":""วันนี้"",""english"":""today"",""tones"":[""mid"",""high""],""romanization"":""wan-níi""},{""thai"":""ฉัน"",""english"":""I"",""tones"":[""rising""],""tone"":""rising"",""romanization"":""chǎn""},{""thai"":""แทบจะ"",""english"":""barely"",""tones"":[""falling"",""low""],""grammar"":true,""romanization"":""thâep jà""},{""thai"":""ไม่ได้คุยกับใคร"",""english"":""barely talked to anyone"",""tones"":[""falling"",""falling"",""mid"",""low"",""rising""],""romanization"":""mâi dâai khui gàp khrai""}]",medium
เขาแทบจะอ่านไม่ออก,khǎo thâep jà àan mâi àawk,He could barely read it.,"[{""thai"":""เขา"",""english"":""he"",""tones"":[""rising""],""tone"":""rising"",""romanization"":""khǎo""},{""thai"":""แทบจะ"",""english"":""barely"",""tones"":[""falling"",""low""],""grammar"":true,""romanization"":""thâep jà""},{""thai"":""อ่านไม่ออก"",""english"":""could barely read"",""tones"":[""low"",""falling"",""low""],""romanization"":""àan mâi àawk""}]",easy