thai,romanization,english,breakdown,difficulty
ครูให้เราไปแก้ใหม่,khru hai rao pai kae mai,The teacher had us revise it again.,"[{""thai"":""ครู"",""english"":""teacher"",""tones"":[""mid""],""tone"":""mid"",""romanization"":""khru""},{""thai"":""ให้"",""english"":""make / let / have"",""tones"":[""falling""],""tone"":""falling"",""grammar"":true,""romanization"":""hâi""},{""thai"":""เรา"",""english"":""us"",""romanization"":""rao""},{""thai"":""ไป"",""english"":""go / do forward"",""tones"":[""mid""],""tone"":""mid"",""grammar"":true,""romanization"":""pai""},{""thai"":""แก้ใหม่"",""english"":""revise again"",""tones"":[""falling"",""low""],""romanization"":""kâe mài""}]",hard
ครูให้เราไปแก้ใหม่,khruu hai rao bpai gae mai,The teacher had us revise it again.,"[{""thai"":""ครู"",""english"":""the teacher"",""tones"":[""mid""],""tone"":""mid"",""romanization"":""khruu""},{""thai"":""ให้"",""english"":""make / let / have"",""tones"":[""falling""],""tone"":""falling"",""grammar"":true,""romanization"":""hai""},{""thai"":""เรา"",""english"":""us"",""tones"":[""mid""],""tone"":""mid"",""romanization"":""rao""},{""thai"":""ไปแก้ใหม่"",""english"":""go revise it again"",""tones"":[""mid"",""falling"",""falling""],""romanization"":""bpai gae mai""}]",hard
หัวหน้าให้ทีมตรวจอีกครั้ง,hua-naa hai thiim dtruat iik khrang,The manager had the team check it again.,"[{""thai"":""หัวหน้า"",""english"":""the manager"",""tones"":[""rising"",""falling""],""romanization"":""hua-naa""},{""thai"":""ให้"",""english"":""make / let / have"",""tones"":[""falling""],""tone"":""falling"",""grammar"":true,""romanization"":""hai""},{""thai"":""ทีม"",""english"":""the team"",""tones"":[""mid""],""tone"":""mid"",""romanization"":""thiim""},{""thai"":""ตรวจอีกครั้ง"",""english"":""check it again"",""tones"":[""low"",""mid"",""high""],""romanization"":""dtruat iik khrang""}]",hard
แม่ให้ฉันซื้อของก่อน,mae hai chan sue khawng gawn,Mom had me buy the groceries first.,"[{""thai"":""แม่"",""english"":""Mom"",""tones"":[""falling""],""tone"":""falling"",""romanization"":""mae""},{""thai"":""ให้"",""english"":""make / let / have"",""tones"":[""falling""],""tone"":""falling"",""grammar"":true,""romanization"":""hai""},{""thai"":""ฉัน"",""english"":""me"",""tones"":[""rising""],""tone"":""rising"",""romanization"":""chan""},{""thai"":""ซื้อของก่อน"",""english"":""buy things first"",""tones"":[""high"",""rising"",""falling""],""romanization"":""sue khawng gawn""}]",hard
พ่อให้น้องนอนเร็วขึ้น,phaw hai nawng nawn reo kheun,Dad made my younger sibling sleep earlier.,"[{""thai"":""พ่อ"",""english"":""Dad"",""tones"":[""falling""],""tone"":""falling"",""romanization"":""phaw""},{""thai"":""ให้"",""english"":""make / let / have"",""tones"":[""falling""],""tone"":""falling"",""grammar"":true,""romanization"":""hai""},{""thai"":""น้อง"",""english"":""my younger sibling"",""tones"":[""high""],""tone"":""high"",""romanization"":""nawng""},{""thai"":""นอนเร็วขึ้น"",""english"":""sleep earlier"",""tones"":[""mid"",""mid"",""falling""],""romanization"":""nawn reo kheun""}]",hard
ลูกค้าให้เราส่งไฟล์ใหม่,luuk-khaa hai rao song fai mai,The client had us send a new file.,"[{""thai"":""ลูกค้า"",""english"":""the client"",""tones"":[""falling"",""high""],""romanization"":""luuk-khaa""},{""thai"":""ให้"",""english"":""make / let / have"",""tones"":[""falling""],""tone"":""falling"",""grammar"":true,""romanization"":""hai""},{""thai"":""เรา"",""english"":""us"",""tones"":[""mid""],""tone"":""mid"",""romanization"":""rao""},{""thai"":""ส่งไฟล์ใหม่"",""english"":""send a new file"",""tones"":[""rising"",""mid"",""falling""],""romanization"":""song fai mai""}]",hard
เขาให้ฉันรอข้างนอก,khao hai chan raw khaang nawk,He had me wait outside.,"[{""thai"":""เขา"",""english"":""he"",""tones"":[""rising""],""tone"":""rising"",""romanization"":""khao""},{""thai"":""ให้"",""english"":""make / let / have"",""tones"":[""falling""],""tone"":""falling"",""grammar"":true,""romanization"":""hai""},{""thai"":""ฉัน"",""english"":""me"",""tones"":[""rising""],""tone"":""rising"",""romanization"":""chan""},{""thai"":""รอข้างนอก"",""english"":""wait outside"",""tones"":[""mid"",""falling"",""low""],""romanization"":""raw khaang nawk""}]",hard
อาจารย์ให้นักเรียนอ่านดังๆ,aa-jaan hai nak-riian aan dang-dang,The instructor had the students read aloud.,"[{""thai"":""อาจารย์"",""english"":""the instructor"",""tones"":[""mid"",""mid""],""romanization"":""aa-jaan""},{""thai"":""ให้"",""english"":""make / let / have"",""tones"":[""falling""],""tone"":""falling"",""grammar"":true,""romanization"":""hai""},{""thai"":""นักเรียน"",""english"":""the students"",""tones"":[""high"",""mid""],""romanization"":""nak-riian""},{""thai"":""อ่านดังๆ"",""english"":""read aloud"",""tones"":[""low"",""mid"",""mid""],""romanization"":""aan dang-dang""}]",hard
หัวหน้าให้ผมคุยกับลูกค้าเอง,hua-naa hai phom khui gap luuk-khaa eng,The manager had me talk to the client myself.,"[{""thai"":""หัวหน้า"",""english"":""the manager"",""tones"":[""rising"",""falling""],""romanization"":""hua-naa""},{""thai"":""ให้"",""english"":""make / let / have"",""tones"":[""falling""],""tone"":""falling"",""grammar"":true,""romanization"":""hai""},{""thai"":""ผม"",""english"":""me"",""tones"":[""rising""],""tone"":""rising"",""romanization"":""phom""},{""thai"":""คุยกับลูกค้าเอง"",""english"":""talk to the client myself"",""tones"":[""mid"",""low"",""falling"",""high"",""mid""],""romanization"":""khui gap luuk-khaa eng""}]",hard
แม่ให้พี่พาน้องกลับบ้าน,mae hai phii phaa nawng glap baan,Mom had my older sibling take the younger one home.,"[{""thai"":""แม่"",""english"":""Mom"",""tones"":[""falling""],""tone"":""falling"",""romanization"":""mae""},{""thai"":""ให้"",""english"":""make / let / have"",""tones"":[""falling""],""tone"":""falling"",""grammar"":true,""romanization"":""hai""},{""thai"":""พี่"",""english"":""my older sibling"",""tones"":[""falling""],""tone"":""falling"",""romanization"":""phii""},{""thai"":""พาน้องกลับบ้าน"",""english"":""take the younger one home"",""tones"":[""mid"",""high"",""low"",""falling""],""romanization"":""phaa nawng glap baan""}]",hard
ครูให้เขาเขียนช้าลง,khruu hai khao khian chaa long,The teacher had him write more slowly.,"[{""thai"":""ครู"",""english"":""the teacher"",""tones"":[""mid""],""tone"":""mid"",""romanization"":""khruu""},{""thai"":""ให้"",""english"":""make / let / have"",""tones"":[""falling""],""tone"":""falling"",""grammar"":true,""romanization"":""hai""},{""thai"":""เขา"",""english"":""him"",""tones"":[""rising""],""tone"":""rising"",""romanization"":""khao""},{""thai"":""เขียนช้าลง"",""english"":""write more slowly"",""tones"":[""rising"",""high"",""mid""],""romanization"":""khian chaa long""}]",hard
หัวหน้าให้เราทำสรุปสั้นๆ,hua-naa hai rao tham sa-rup san-san,The manager had us make a short summary.,"[{""thai"":""หัวหน้า"",""english"":""the manager"",""tones"":[""rising"",""falling""],""romanization"":""hua-naa""},{""thai"":""ให้"",""english"":""make / let / have"",""tones"":[""falling""],""tone"":""falling"",""grammar"":true,""romanization"":""hai""},{""thai"":""เรา"",""english"":""us"",""tones"":[""mid""],""tone"":""mid"",""romanization"":""rao""},{""thai"":""ทำสรุปสั้นๆ"",""english"":""make a short summary"",""tones"":[""mid"",""low"",""high"",""high""],""romanization"":""tham sa-rup san-san""}]",hard
พ่อให้ช่างมาดูรถ,phaw hai chang maa duu rot,Dad had the mechanic come look at the car.,"[{""thai"":""พ่อ"",""english"":""Dad"",""tones"":[""falling""],""tone"":""falling"",""romanization"":""phaw""},{""thai"":""ให้"",""english"":""make / let / have"",""tones"":[""falling""],""tone"":""falling"",""grammar"":true,""romanization"":""hai""},{""thai"":""ช่าง"",""english"":""the mechanic"",""tones"":[""falling""],""tone"":""falling"",""romanization"":""chang""},{""thai"":""มาดูรถ"",""english"":""come look at the car"",""tones"":[""mid"",""mid"",""high""],""romanization"":""maa duu rot""}]",hard
เธอให้เพื่อนช่วยถือของ,thoe hai phuean chuai theu khawng,She had her friend help carry the bags.,"[{""thai"":""เธอ"",""english"":""she"",""tones"":[""mid""],""tone"":""mid"",""romanization"":""thoe""},{""thai"":""ให้"",""english"":""make / let / have"",""tones"":[""falling""],""tone"":""falling"",""grammar"":true,""romanization"":""hai""},{""thai"":""เพื่อน"",""english"":""her friend"",""tones"":[""falling""],""tone"":""falling"",""romanization"":""phuean""},{""thai"":""ช่วยถือของ"",""english"":""help carry the bags"",""tones"":[""falling"",""mid"",""rising""],""romanization"":""chuai theu khawng""}]",hard
บริษัทให้พนักงานใหม่อบรมเพิ่ม,baw-ri-sat hai pha-nak-ngaan mai op-rom pherme,The company had the new employee do extra training.,"[{""thai"":""บริษัท"",""english"":""the company"",""tones"":[""mid"",""mid"",""low""],""romanization"":""baw-ri-sat""},{""thai"":""ให้"",""english"":""make / let / have"",""tones"":[""falling""],""tone"":""falling"",""grammar"":true,""romanization"":""hai""},{""thai"":""พนักงานใหม่"",""english"":""the new employee"",""tones"":[""high"",""high"",""mid"",""falling""],""romanization"":""pha-nak-ngaan mai""},{""thai"":""อบรมเพิ่ม"",""english"":""do extra training"",""tones"":[""low"",""mid"",""falling""],""romanization"":""op-rom pherme""}]",hard
ครูให้เด็กๆยืนเป็นแถว,khruu hai dek dek yeun bpen thaeo,The teacher had the children stand in a line.,"[{""thai"":""ครู"",""english"":""the teacher"",""tones"":[""mid""],""tone"":""mid"",""romanization"":""khruu""},{""thai"":""ให้"",""english"":""make / let / have"",""tones"":[""falling""],""tone"":""falling"",""grammar"":true,""romanization"":""hai""},{""thai"":""เด็กๆ"",""english"":""the children"",""tones"":[""low"",""low""],""romanization"":""dek dek""},{""thai"":""ยืนเป็นแถว"",""english"":""stand in a line"",""tones"":[""mid"",""mid"",""mid""],""romanization"":""yeun bpen thaeo""}]",hard
หัวหน้าให้ฝ่ายผลิตหยุดก่อน,hua-naa hai faai pha-lit yut gawn,The manager had the production team pause first.,"[{""thai"":""หัวหน้า"",""english"":""the manager"",""tones"":[""rising"",""falling""],""romanization"":""hua-naa""},{""thai"":""ให้"",""english"":""make / let / have"",""tones"":[""falling""],""tone"":""falling"",""grammar"":true,""romanization"":""hai""},{""thai"":""ฝ่ายผลิต"",""english"":""the production team"",""tones"":[""falling"",""high"",""falling""],""romanization"":""faai pha-lit""},{""thai"":""หยุดก่อน"",""english"":""pause first"",""tones"":[""low"",""falling""],""romanization"":""yut gawn""}]",hard
ลูกค้าให้ทีมออกแบบปรับสีใหม่,luuk-khaa hai thiim awk-baep bprap sii mai,The client had the design team adjust the colors again.,"[{""thai"":""ลูกค้า"",""english"":""the client"",""tones"":[""falling"",""high""],""romanization"":""luuk-khaa""},{""thai"":""ให้"",""english"":""make / let / have"",""tones"":[""falling""],""tone"":""falling"",""grammar"":true,""romanization"":""hai""},{""thai"":""ทีมออกแบบ"",""english"":""the design team"",""tones"":[""mid"",""low"",""low""],""romanization"":""thiim awk-baep""},{""thai"":""ปรับสีใหม่"",""english"":""adjust the colors again"",""tones"":[""low"",""rising"",""falling""],""romanization"":""bprap sii mai""}]",hard
เขาให้ผมอธิบายอีกที,khao hai phom a-thi-baai iik thii,He had me explain it again.,"[{""thai"":""เขา"",""english"":""he"",""tones"":[""rising""],""tone"":""rising"",""romanization"":""khao""},{""thai"":""ให้"",""english"":""make / let / have"",""tones"":[""falling""],""tone"":""falling"",""grammar"":true,""romanization"":""hai""},{""thai"":""ผม"",""english"":""me"",""tones"":[""rising""],""tone"":""rising"",""romanization"":""phom""},{""thai"":""อธิบายอีกที"",""english"":""explain it again"",""tones"":[""low"",""high"",""mid"",""mid""],""romanization"":""a-thi-baai iik thii""}]",hard
แม่ให้ฉันกินยาก่อนนอน,mae hai chan gin yaa gawn nawn,Mom made me take medicine before bed.,"[{""thai"":""แม่"",""english"":""Mom"",""tones"":[""falling""],""tone"":""falling"",""romanization"":""mae""},{""thai"":""ให้"",""english"":""make / let / have"",""tones"":[""falling""],""tone"":""falling"",""grammar"":true,""romanization"":""hai""},{""thai"":""ฉัน"",""english"":""me"",""tones"":[""rising""],""tone"":""rising"",""romanization"":""chan""},{""thai"":""กินยาก่อนนอน"",""english"":""take medicine before bed"",""tones"":[""mid"",""mid"",""falling"",""mid""],""romanization"":""gin yaa gawn nawn""}]",hard
พ่อให้เราโทรบอกญาติ,phaw hai rao thoo bok yaat,Dad had us call the relatives.,"[{""thai"":""พ่อ"",""english"":""Dad"",""tones"":[""falling""],""tone"":""falling"",""romanization"":""phaw""},{""thai"":""ให้"",""english"":""make / let / have"",""tones"":[""falling""],""tone"":""falling"",""grammar"":true,""romanization"":""hai""},{""thai"":""เรา"",""english"":""us"",""tones"":[""mid""],""tone"":""mid"",""romanization"":""rao""},{""thai"":""โทรบอกญาติ"",""english"":""call and tell the relatives"",""tones"":[""mid"",""low"",""falling""],""romanization"":""thoo bok yaat""}]",hard
หัวหน้าให้ทุกคนปิดโทรศัพท์,hua-naa hai thuk-khon bpit thoo-ra-sap,The manager had everyone turn off their phones.,"[{""thai"":""หัวหน้า"",""english"":""the manager"",""tones"":[""rising"",""falling""],""romanization"":""hua-naa""},{""thai"":""ให้"",""english"":""make / let / have"",""tones"":[""falling""],""tone"":""falling"",""grammar"":true,""romanization"":""hai""},{""thai"":""ทุกคน"",""english"":""everyone"",""tones"":[""high"",""mid""],""romanization"":""thuk-khon""},{""thai"":""ปิดโทรศัพท์"",""english"":""turn off their phones"",""tones"":[""low"",""mid"",""high"",""low""],""romanization"":""bpit thoo-ra-sap""}]",hard
ครูให้นักเรียนใหม่แนะนำตัวเอง,khruu hai nak-riian mai nae-nam dtua eng,The teacher had the new students introduce themselves.,"[{""thai"":""ครู"",""english"":""the teacher"",""tones"":[""mid""],""tone"":""mid"",""romanization"":""khruu""},{""thai"":""ให้"",""english"":""make / let / have"",""tones"":[""falling""],""tone"":""falling"",""grammar"":true,""romanization"":""hai""},{""thai"":""นักเรียนใหม่"",""english"":""the new students"",""tones"":[""high"",""mid"",""falling""],""romanization"":""nak-riian mai""},{""thai"":""แนะนำตัวเอง"",""english"":""introduce themselves"",""tones"":[""falling"",""mid"",""mid"",""mid""],""romanization"":""nae-nam dtua eng""}]",hard
ลูกค้าให้เราแก้เงื่อนไขนี้,luuk-khaa hai rao gae nguean-khai nii,The client had us revise this condition.,"[{""thai"":""ลูกค้า"",""english"":""the client"",""tones"":[""falling"",""high""],""romanization"":""luuk-khaa""},{""thai"":""ให้"",""english"":""make / let / have"",""tones"":[""falling""],""tone"":""falling"",""grammar"":true,""romanization"":""hai""},{""thai"":""เรา"",""english"":""us"",""tones"":[""mid""],""tone"":""mid"",""romanization"":""rao""},{""thai"":""แก้เงื่อนไขนี้"",""english"":""revise this condition"",""tones"":[""falling"",""mid"",""falling"",""high""],""romanization"":""gae nguean-khai nii""}]",hard
เขาให้ฉันกลับมาคุยพรุ่งนี้,khao hai chan glap maa khui phrung-nii,He had me come back to talk tomorrow.,"[{""thai"":""เขา"",""english"":""he"",""tones"":[""rising""],""tone"":""rising"",""romanization"":""khao""},{""thai"":""ให้"",""english"":""make / let / have"",""tones"":[""falling""],""tone"":""falling"",""grammar"":true,""romanization"":""hai""},{""thai"":""ฉัน"",""english"":""me"",""tones"":[""rising""],""tone"":""rising"",""romanization"":""chan""},{""thai"":""กลับมาคุยพรุ่งนี้"",""english"":""come back to talk tomorrow"",""tones"":[""low"",""mid"",""mid"",""mid"",""high""],""romanization"":""glap maa khui phrung-nii""}]",hard
อาจารย์ให้นักศึกษาส่งงานก่อนเที่ยง,aa-jaan hai nak-seuk-saa song ngaan gawn thiang,The instructor had the students submit the work before noon.,"[{""thai"":""อาจารย์"",""english"":""the instructor"",""tones"":[""mid"",""mid""],""romanization"":""aa-jaan""},{""thai"":""ให้"",""english"":""make / let / have"",""tones"":[""falling""],""tone"":""falling"",""grammar"":true,""romanization"":""hai""},{""thai"":""นักศึกษา"",""english"":""the students"",""tones"":[""high"",""low"",""rising""],""romanization"":""nak-seuk-saa""},{""thai"":""ส่งงานก่อนเที่ยง"",""english"":""submit the work before noon"",""tones"":[""rising"",""mid"",""falling"",""falling""],""romanization"":""song ngaan gawn thiang""}]",hard