thai,romanization,english,breakdown,difficulty
แม้ว่าเธอจะไม่เห็นด้วย เธอก็ฟังจนจบ,maewaa thoe cha mai hen duai thoe ko fang jon jop,"Even though she doesn't agree, she still listens to the end.","[{""thai"":""แม้ว่า"",""english"":""even though"",""tones"":[""high"",""falling""],""grammar"":true,""romanization"":""maewaa""},{""thai"":""เธอจะไม่เห็นด้วย"",""english"":""she doesn't agree"",""tones"":[""mid"",""low"",""falling"",""rising"",""falling""],""romanization"":""thoe cha mai hen duai""},{""thai"":""เธอก็ฟังจนจบ"",""english"":""she still listens to the end"",""tones"":[""mid"",""falling"",""mid"",""mid"",""low""],""romanization"":""thoe ko fang jon jop""}]",medium
แม้ว่าร้านจะปิดเร็ว เราก็ยังไปทัน,maewaa raan cha pit reo rao ko yang pai than,"Even though the shop closes early, we can still make it in time.","[{""thai"":""แม้ว่า"",""english"":""even though"",""tones"":[""high"",""falling""],""grammar"":true,""romanization"":""maewaa""},{""thai"":""ร้านจะปิดเร็ว"",""english"":""the shop closes early"",""tones"":[""high"",""low"",""low"",""mid""],""romanization"":""raan cha pit reo""},{""thai"":""เราก็ยังไปทัน"",""english"":""we can still make it in time"",""tones"":[""mid"",""falling"",""mid"",""mid"",""mid""],""romanization"":""rao ko yang pai than""}]",medium
แม้ว่าฉันจะลืมสมุด ฉันก็ยังจำรายละเอียดได้,maewaa chan cha luem samut chan ko yang jam raailaaiat dai,"Even though I forgot my notebook, I still remember the details.","[{""thai"":""แม้ว่า"",""english"":""even though"",""tones"":[""high"",""falling""],""grammar"":true,""romanization"":""maewaa""},{""thai"":""ฉันจะลืมสมุด"",""english"":""I forgot my notebook"",""tones"":[""rising"",""low"",""mid"",""low""],""romanization"":""chan cha luem samut""},{""thai"":""ฉันก็ยังจำรายละเอียดได้"",""english"":""I still remember the details"",""tones"":[""rising"",""falling"",""mid"",""mid"",""mid"",""low"",""falling""],""romanization"":""chan ko yang jam raailaaiat dai""}]",medium
แม้ว่าทีมจะน้อยคน งานก็เดินต่อได้,maewaa thiim cha noi khon ngaan ko doen to dai,"Even though the team is small, the work can still continue.","[{""thai"":""แม้ว่า"",""english"":""even though"",""tones"":[""high"",""falling""],""grammar"":true,""romanization"":""maewaa""},{""thai"":""ทีมจะน้อยคน"",""english"":""the team has few people"",""tones"":[""mid"",""low"",""high"",""mid""],""romanization"":""thiim cha noi khon""},{""thai"":""งานก็เดินต่อได้"",""english"":""the work can still continue"",""tones"":[""mid"",""falling"",""mid"",""low"",""falling""],""romanization"":""ngaan ko doen to dai""}]",medium
แม้ว่าภาษาไทยจะยากสำหรับเขา เขาก็ยังฝึกทุกวัน,maewaa phaasaa thai cha yaak samrap khao khao ko yang fuk thuk wan,"Even though Thai is difficult for him, he still practices every day.","[{""thai"":""แม้ว่า"",""english"":""even though"",""tones"":[""high"",""falling""],""grammar"":true,""romanization"":""maewaa""},{""thai"":""ภาษาไทยจะยากสำหรับเขา"",""english"":""Thai is difficult for him"",""tones"":[""rising"",""mid"",""mid"",""low"",""falling"",""rising"",""low"",""rising""],""romanization"":""phaasaa thai cha yaak samrap khao""},{""thai"":""เขาก็ยังฝึกทุกวัน"",""english"":""he still practices every day"",""tones"":[""rising"",""falling"",""mid"",""low"",""high"",""mid""],""romanization"":""khao ko yang fuk thuk wan""}]",medium
แม้ว่าแม่จะกังวล แม่ก็ยังปล่อยให้ฉันตัดสินใจเอง,maewaa mae cha kangwon mae ko yang ploi hai chan tatsin jai eng,"Even though Mom is worried, she still lets me decide for myself.","[{""thai"":""แม้ว่า"",""english"":""even though"",""tones"":[""high"",""falling""],""grammar"":true,""romanization"":""maewaa""},{""thai"":""แม่จะกังวล"",""english"":""Mom is worried"",""tones"":[""falling"",""low"",""mid"",""mid""],""romanization"":""mae cha kangwon""},{""thai"":""แม่ก็ยังปล่อยให้ฉันตัดสินใจเอง"",""english"":""Mom still lets me decide for myself"",""tones"":[""falling"",""falling"",""mid"",""low"",""falling"",""rising"",""low"",""rising"",""mid"",""mid""],""romanization"":""mae ko yang ploi hai chan tatsin jai eng""}]",medium
แม้ว่าผลจะยังไม่ชัด เราก็เริ่มเตรียมไว้ก่อน,maewaa phon cha yang mai chat rao ko roem triiam wai kon,"Even though the result still isn't clear, we've started preparing in advance.","[{""thai"":""แม้ว่า"",""english"":""even though"",""tones"":[""high"",""falling""],""grammar"":true,""romanization"":""maewaa""},{""thai"":""ผลจะยังไม่ชัด"",""english"":""the result still isn't clear"",""tones"":[""rising"",""low"",""mid"",""falling"",""high""],""romanization"":""phon cha yang mai chat""},{""thai"":""เราก็เริ่มเตรียมไว้ก่อน"",""english"":""we've already started preparing"",""tones"":[""mid"",""falling"",""falling"",""mid"",""high"",""low""],""romanization"":""rao ko roem triiam wai kon""}]",medium
แม้ว่าอากาศจะร้อน ลูกค้าก็นั่งข้างนอกกันเยอะ,maewaa aakaat cha ron luukkhaa ko nang khaang nok kan yoe,"Even though the weather is hot, many customers still sit outside.","[{""thai"":""แม้ว่า"",""english"":""even though"",""tones"":[""high"",""falling""],""grammar"":true,""romanization"":""maewaa""},{""thai"":""อากาศจะร้อน"",""english"":""the weather is hot"",""tones"":[""low"",""low"",""low"",""high""],""romanization"":""aakaat cha ron""},{""thai"":""ลูกค้าก็นั่งข้างนอกกันเยอะ"",""english"":""many customers still sit outside"",""tones"":[""falling"",""high"",""falling"",""falling"",""falling"",""mid"",""mid"",""high""],""romanization"":""luukkhaa ko nang khaang nok kan yoe""}]",medium
แม้ว่าข้อมูลจะยังไม่ครบ เราก็พอเห็นภาพแล้ว,maewaa khomuun cha yang mai khrop rao ko pho hen phaap laeo,"Even though the information still isn't complete, we can already see the picture.","[{""thai"":""แม้ว่า"",""english"":""even though"",""tones"":[""high"",""falling""],""grammar"":true,""romanization"":""maewaa""},{""thai"":""ข้อมูลจะยังไม่ครบ"",""english"":""the information still isn't complete"",""tones"":[""falling"",""mid"",""low"",""mid"",""falling"",""high""],""romanization"":""khomuun cha yang mai khrop""},{""thai"":""เราก็พอเห็นภาพแล้ว"",""english"":""we can already see the picture"",""tones"":[""mid"",""falling"",""mid"",""rising"",""falling"",""high""],""romanization"":""rao ko pho hen phaap laeo""}]",medium
แม้ว่าเขาจะไม่ได้พูดมาก ทุกคนก็เชื่อใจเขา,maewaa khao cha mai dai phuut maak thuk khon ko chueajai khao,"Even though he doesn't say much, everyone trusts him.","[{""thai"":""แม้ว่า"",""english"":""even though"",""tones"":[""high"",""falling""],""grammar"":true,""romanization"":""maewaa""},{""thai"":""เขาจะไม่ได้พูดมาก"",""english"":""he doesn't say much"",""tones"":[""rising"",""low"",""falling"",""falling"",""falling"",""falling""],""romanization"":""khao cha mai dai phuut maak""},{""thai"":""ทุกคนก็เชื่อใจเขา"",""english"":""everyone trusts him"",""tones"":[""high"",""mid"",""falling"",""falling"",""mid"",""rising""],""romanization"":""thuk khon ko chueajai khao""}]",medium
แม้ว่าฉันจะพลาดครั้งแรก ฉันก็ลองใหม่อีกครั้ง,maewaa chan cha phlaat khrang raek chan ko long mai iik khrang,"Even though I missed the first try, I tried again.","[{""thai"":""แม้ว่า"",""english"":""even though"",""tones"":[""high"",""falling""],""grammar"":true,""romanization"":""maewaa""},{""thai"":""ฉันจะพลาดครั้งแรก"",""english"":""I missed the first try"",""tones"":[""rising"",""low"",""falling"",""high"",""falling""],""romanization"":""chan cha phlaat khrang raek""},{""thai"":""ฉันก็ลองใหม่อีกครั้ง"",""english"":""I tried again"",""tones"":[""rising"",""falling"",""mid"",""falling"",""low"",""high""],""romanization"":""chan ko long mai iik khrang""}]",medium
แม้ว่าเขาจะอยู่ไกล เขาก็มาทันประชุม,maewaa khao cha yuu glai khao ko maa than prachum,"Even though he lives far away, he still made it to the meeting in time.","[{""thai"":""แม้ว่า"",""english"":""even though"",""tones"":[""high"",""falling""],""grammar"":true,""romanization"":""maewaa""},{""thai"":""เขาจะอยู่ไกล"",""english"":""he lives far away"",""tones"":[""rising"",""low"",""low"",""mid""],""romanization"":""khao cha yuu glai""},{""thai"":""เขาก็มาทันประชุม"",""english"":""he still made it to the meeting in time"",""tones"":[""rising"",""falling"",""mid"",""mid"",""low"",""mid""],""romanization"":""khao ko maa than prachum""}]",medium
แม้ว่าจะต้องใช้เวลาหน่อย ผลลัพธ์ก็คุ้มค่า,maewaa cha tong chai welaa noi phonlap ko khumkhaa,"Even though it takes a bit of time, the result is worth it.","[{""thai"":""แม้ว่า"",""english"":""even though"",""tones"":[""high"",""falling""],""grammar"":true,""romanization"":""maewaa""},{""thai"":""จะต้องใช้เวลาหน่อย"",""english"":""it will take a bit of time"",""tones"":[""low"",""falling"",""high"",""mid"",""mid"",""low""],""romanization"":""cha tong chai welaa noi""},{""thai"":""ผลลัพธ์ก็คุ้มค่า"",""english"":""the result is worth it"",""tones"":[""rising"",""high"",""falling"",""falling""],""romanization"":""phonlap ko khumkhaa""}]",medium
แม้ว่าเขาจะพูดน้อย ทุกคนก็ยังอยากฟังความเห็นของเขา,maewaa khao cha phuut noi thuk khon ko yang yaak fang khwaam hen khong khao,"Even though he doesn't say much, everyone still wants to hear his opinion.","[{""thai"":""แม้ว่า"",""english"":""even though"",""tones"":[""high"",""falling""],""grammar"":true,""romanization"":""maewaa""},{""thai"":""เขาจะพูดน้อย"",""english"":""he speaks little"",""tones"":[""rising"",""low"",""falling"",""high""],""romanization"":""khao cha phuut noi""},{""thai"":""ทุกคนก็ยังอยากฟังความเห็นของเขา"",""english"":""everyone still wants to hear his opinion"",""tones"":[""high"",""mid"",""falling"",""mid"",""falling"",""mid"",""mid"",""rising"",""rising""],""romanization"":""thuk khon ko yang yaak fang khwaam hen khong khao""}]",medium