thai,romanization,english,breakdown,difficulty
ดื่มน้ำแทนที่จะกินขนม,duem nam thaen thi cha kin khanom,Drink water instead of eating snacks.,"[{""thai"":""ดื่ม"",""english"":""drink"",""tones"":[""low""],""tone"":""low"",""romanization"":""duem""},{""thai"":""น้ำ"",""english"":""water"",""tones"":[""high""],""tone"":""high"",""romanization"":""nam""},{""thai"":""แทนที่จะ"",""english"":""instead of"",""grammar"":true,""romanization"":""thaen thî jà""},{""thai"":""กิน"",""english"":""eat"",""tones"":[""mid""],""tone"":""mid"",""romanization"":""kin""},{""thai"":""ขนม"",""english"":""snack"",""romanization"":""khanom""}]",easy
นอนพักแทนที่จะออกไป,non phak thaen thi cha ok pai,Rest instead of going out.,"[{""thai"":""นอนพัก"",""english"":""rest"",""romanization"":""non phak""},{""thai"":""แทนที่จะ"",""english"":""instead of"",""grammar"":true,""romanization"":""thaen thî jà""},{""thai"":""ออกไป"",""english"":""go out"",""romanization"":""ok pai""}]",easy
เขาเลือกไปวิ่งแทนที่จะนอนอยู่บ้าน,khǎo lûeak pai wîng thâen thî jà non yùu bâan,He chose to go running instead of staying at home.,"[{""thai"":""เขาเลือก"",""english"":""he chose"",""tones"":[""rising"",""falling""],""romanization"":""khǎo lûeak""},{""thai"":""ไปวิ่ง"",""english"":""to go running"",""romanization"":""pai wîng""},{""thai"":""แทนที่จะ"",""english"":""instead of"",""tones"":[""falling"",""falling"",""low""],""grammar"":true,""romanization"":""thâen thî jà""},{""thai"":""นอนอยู่บ้าน"",""english"":""staying at home"",""romanization"":""non yùu bâan""}]",medium
เธออ่านหนังสือแทนที่จะดูทีวี,thoe àan nǎngsǔe thâen thî jà duu thiiwii,She reads a book instead of watching TV.,"[{""thai"":""เธออ่านหนังสือ"",""english"":""she reads a book"",""romanization"":""thoe àan nǎngsǔe""},{""thai"":""แทนที่จะ"",""english"":""instead of"",""tones"":[""falling"",""falling"",""low""],""grammar"":true,""romanization"":""thâen thî jà""},{""thai"":""ดูทีวี"",""english"":""watching TV"",""romanization"":""duu thiiwii""}]",easy
พวกเขาประชุมแทนที่จะพักผ่อน,phûak khǎo prachum thâen thî jà phákphǒn,They had a meeting instead of relaxing.,"[{""thai"":""พวกเขาประชุม"",""english"":""they had a meeting"",""romanization"":""phûak khǎo prachum""},{""thai"":""แทนที่จะ"",""english"":""instead of"",""tones"":[""falling"",""falling"",""low""],""grammar"":true,""romanization"":""thâen thî jà""},{""thai"":""พักผ่อน"",""english"":""relaxing"",""romanization"":""phákphǒn""}]",medium
เขาทำงานชดเชยแทนที่จะลา,khǎo tham-ngaan chótchoei thâen thî jà laa,He worked overtime instead of taking leave.,"[{""thai"":""เขาทำงานชดเชย"",""english"":""he worked overtime"",""romanization"":""khǎo tham-ngaan chótchoei""},{""thai"":""แทนที่จะ"",""english"":""instead of"",""tones"":[""falling"",""falling"",""low""],""grammar"":true,""romanization"":""thâen thî jà""},{""thai"":""ลา"",""english"":""taking leave"",""tones"":[""mid""],""tone"":""mid"",""romanization"":""laa""}]",medium
นักเรียนตั้งใจฟังแทนที่จะเล่นโทรศัพท์,nák-rian tângjai fang thâen thî jà lên thohrasàpph,The student paid attention instead of playing on the phone.,"[{""thai"":""นักเรียนตั้งใจฟัง"",""english"":""the student paid attention"",""romanization"":""nák-rian tângjai fang""},{""thai"":""แทนที่จะ"",""english"":""instead of"",""tones"":[""falling"",""falling"",""low""],""grammar"":true,""romanization"":""thâen thî jà""},{""thai"":""เล่นโทรศัพท์"",""english"":""playing on the phone"",""tones"":[""falling"",""low""],""romanization"":""lên thohrasàpph""}]",medium
แม่ทำอาหารแทนที่จะสั่งซื้อ,mâe tham ahǎan thâen thî jà sàng sǔe,Mom cooked instead of ordering food.,"[{""thai"":""แม่ทำอาหาร"",""english"":""mom cooked"",""romanization"":""mâe tham ahǎan""},{""thai"":""แทนที่จะ"",""english"":""instead of"",""tones"":[""falling"",""falling"",""low""],""grammar"":true,""romanization"":""thâen thî jà""},{""thai"":""สั่งซื้อ"",""english"":""ordering food"",""tones"":[""low"",""rising""],""romanization"":""sàng sǔe""}]",easy
เขียนบทความแทนที่จะเขียนนิยาย,khǐan bòt-khwam thâen thî jà khǐan niyaai,Write an article instead of writing a novel.,"[{""thai"":""เขียนบทความ"",""english"":""write an article"",""romanization"":""khǐan bòt-khwam""},{""thai"":""แทนที่จะ"",""english"":""instead of"",""tones"":[""falling"",""falling"",""low""],""grammar"":true,""romanization"":""thâen thî jà""},{""thai"":""เขียนนิยาย"",""english"":""writing a novel"",""romanization"":""khǐan niyaai""}]",hard
เขาเลือกรถใหม่แทนที่จะซ่อมคันเดิม,khǎo lûeak rót mài thâen thî jà sôm khan deum,He chose a new car instead of fixing the old one.,"[{""thai"":""เขาเลือก"",""english"":""he chose"",""tones"":[""rising"",""falling""],""romanization"":""khǎo lûeak""},{""thai"":""รถใหม่"",""english"":""a new car"",""tones"":[""high"",""low""],""romanization"":""rót mài""},{""thai"":""แทนที่จะ"",""english"":""instead of"",""tones"":[""falling"",""falling"",""low""],""grammar"":true,""romanization"":""thâen thî jà""},{""thai"":""ซ่อมคันเดิม"",""english"":""fixing the old one"",""romanization"":""sôm khan deum""}]",medium
เพื่อนออกไปวิ่งแทนที่จะนั่งเล่นในบ้าน,phûean òk pai wîng thâen thî jà nâng lên nai bâan,A friend went for a run instead of just sitting inside.,"[{""thai"":""เพื่อนออกไปวิ่ง"",""english"":""a friend went for a run"",""romanization"":""phûean òk pai wîng""},{""thai"":""แทนที่จะ"",""english"":""instead of"",""tones"":[""falling"",""falling"",""low""],""grammar"":true,""romanization"":""thâen thî jà""},{""thai"":""นั่งเล่นในบ้าน"",""english"":""just sitting inside"",""romanization"":""nâng lên nai bâan""}]",medium
เธอออกจากบ้านเช้าแทนที่จะมาสาย,thoe òk jàak bâan cháo thâen thî jà maa sǎai,She left home early instead of arriving late.,"[{""thai"":""เธอออกจากบ้านเช้า"",""english"":""she left home early"",""romanization"":""thoe òk jàak bâan cháo""},{""thai"":""แทนที่จะ"",""english"":""instead of"",""tones"":[""falling"",""falling"",""low""],""grammar"":true,""romanization"":""thâen thî jà""},{""thai"":""มาสาย"",""english"":""arriving late"",""romanization"":""maa sǎai""}]",easy
เขาดูหนังสือแทนที่จะไปเที่ยว,khǎo duu nǎngsǔe thâen thî jà pai thîaw,He studied instead of going out.,"[{""thai"":""เขาดูหนังสือ"",""english"":""he studied"",""romanization"":""khǎo duu nǎngsǔe""},{""thai"":""แทนที่จะ"",""english"":""instead of"",""tones"":[""falling"",""falling"",""low""],""grammar"":true,""romanization"":""thâen thî jà""},{""thai"":""ไปเที่ยว"",""english"":""going out"",""romanization"":""pai thîaw""}]",medium
ฉันเลือกฟังเพลงแทนที่จะอ่านข่าว,chǎn lûeak fang phlaeng thâen thî jà àan khàao,I chose to listen to music instead of reading the news.,"[{""thai"":""ฉันเลือก"",""english"":""I chose"",""tones"":[""rising"",""falling""],""romanization"":""chǎn lûeak""},{""thai"":""ฟังเพลง"",""english"":""to listen to music"",""romanization"":""fang phlaeng""},{""thai"":""แทนที่จะ"",""english"":""instead of"",""tones"":[""falling"",""falling"",""low""],""grammar"":true,""romanization"":""thâen thî jà""},{""thai"":""อ่านข่าว"",""english"":""reading the news"",""tones"":[""low"",""low""],""romanization"":""àan khàao""}]",medium
เราไปปิกนิกแทนที่จะอยู่ในห้อง,rao pai pik nik thâen thî jà yùu nai hông,We went for a picnic instead of staying in the room.,"[{""thai"":""เราไปปิกนิก"",""english"":""we went for a picnic"",""romanization"":""rao pai pik nik""},{""thai"":""แทนที่จะ"",""english"":""instead of"",""tones"":[""falling"",""falling"",""low""],""grammar"":true,""romanization"":""thâen thî jà""},{""thai"":""อยู่ในห้อง"",""english"":""staying in the room"",""romanization"":""yùu nai hông""}]",medium
เขาวางแผนทำงานอดิเรกแทนที่จะดูโทรทัศน์,khǎo waang phǎen tham ngaan àdírek thâen thî jà duu thohrathat,He planned to do a hobby instead of watching television.,"[{""thai"":""เขาวางแผน"",""english"":""he planned"",""romanization"":""khǎo waang phǎen""},{""thai"":""ทำงานอดิเรก"",""english"":""to do a hobby"",""romanization"":""tham ngaan àdírek""},{""thai"":""แทนที่จะ"",""english"":""instead of"",""tones"":[""falling"",""falling"",""low""],""grammar"":true,""romanization"":""thâen thî jà""},{""thai"":""ดูโทรทัศน์"",""english"":""watching television"",""romanization"":""duu thohrathat""}]",hard
เธอเลือกแสดงความเห็นแทนที่จะเงียบ,thoe lûeak sadaeng khwaam hèen thâen thî jà ngîap,She chose to express her opinion instead of being silent.,"[{""thai"":""เธอเลือก"",""english"":""she chose"",""romanization"":""thoe lûeak""},{""thai"":""แสดงความเห็น"",""english"":""to express her opinion"",""romanization"":""sadaeng khwaam hèen""},{""thai"":""แทนที่จะ"",""english"":""instead of"",""tones"":[""falling"",""falling"",""low""],""grammar"":true,""romanization"":""thâen thî jà""},{""thai"":""เงียบ"",""english"":""being silent"",""tones"":[""falling""],""tone"":""falling"",""romanization"":""ngîap""}]",medium
เด็กๆ เล่นกีฬาแทนที่จะเล่นเกม,dèk-dèk lên kiilaa thâen thî jà lên geem,The kids played sports instead of playing games.,"[{""thai"":""เด็กๆ เล่นกีฬา"",""english"":""the kids played sports"",""romanization"":""dèk-dèk lên kiilaa""},{""thai"":""แทนที่จะ"",""english"":""instead of"",""tones"":[""falling"",""falling"",""low""],""grammar"":true,""romanization"":""thâen thî jà""},{""thai"":""เล่นเกม"",""english"":""playing games"",""romanization"":""lên geem""}]",easy
ฉันเลือกที่จะออกกำลังกายแทนที่จะนอนอืด,chǎn lûeak thî jà òk kamlang gaai thâen thî jà non ùet,I chose to exercise instead of lying idle.,"[{""thai"":""ฉันเลือกที่จะออกกำลังกาย"",""english"":""I chose to exercise"",""romanization"":""chǎn lûeak thî jà òk kamlang gaai""},{""thai"":""แทนที่จะ"",""english"":""instead of"",""tones"":[""falling"",""falling"",""low""],""grammar"":true,""romanization"":""thâen thî jà""},{""thai"":""นอนอืด"",""english"":""lying idle"",""romanization"":""non ùet""}]",hard
เขาตัดสินใจเรียนต่อแทนที่จะทำงาน,khǎo tàdsǐnjaai rian tò thâen thî jà tham-ngaan,He decided to continue studying instead of working.,"[{""thai"":""เขาตัดสินใจ"",""english"":""he decided"",""romanization"":""khǎo tàdsǐnjaai""},{""thai"":""เรียนต่อ"",""english"":""to continue studying"",""romanization"":""rian tò""},{""thai"":""แทนที่จะ"",""english"":""instead of"",""tones"":[""falling"",""falling"",""low""],""grammar"":true,""romanization"":""thâen thî jà""},{""thai"":""ทำงาน"",""english"":""working"",""romanization"":""tham-ngaan""}]",medium
เธอวางแผนไปเที่ยวต่างประเทศแทนที่จะอยู่บ้าน,thoe waang phǎen pai thîaw tàang bprathêet thâen thî jà yùu bâan,She planned to travel abroad instead of staying home.,"[{""thai"":""เธอวางแผน"",""english"":""she planned"",""romanization"":""thoe waang phǎen""},{""thai"":""ไปเที่ยวต่างประเทศ"",""english"":""to travel abroad"",""romanization"":""pai thîaw tàang bprathêet""},{""thai"":""แทนที่จะ"",""english"":""instead of"",""tones"":[""falling"",""falling"",""low""],""grammar"":true,""romanization"":""thâen thî jà""},{""thai"":""อยู่บ้าน"",""english"":""staying home"",""tones"":[""low"",""falling""],""romanization"":""yùu bâan""}]",hard
เขาเลือกที่จะฟังเพลเยอร์แทนที่จะคาดเดา,khǎo lûeak thî jà fang phléeyer thâen thî jà khâat dao,He chose to listen to the player instead of guessing.,"[{""thai"":""เขาเลือกที่จะฟังเพลเยอร์"",""english"":""he chose to listen to the player"",""romanization"":""khǎo lûeak thî jà fang phléeyer""},{""thai"":""แทนที่จะ"",""english"":""instead of"",""tones"":[""falling"",""falling"",""low""],""grammar"":true,""romanization"":""thâen thî jà""},{""thai"":""คาดเดา"",""english"":""guessing"",""romanization"":""khâat dao""}]",hard
แม่เลือกซื้อผักสดแทนที่จะซื้ออาหารสำเร็จรูป,mâe lûeak sǔe phàk sòt thâen thî jà sǔe ahǎan samrèt rúup,Mom chose to buy fresh vegetables instead of processed food.,"[{""thai"":""แม่เลือกซื้อผักสด"",""english"":""mom chose to buy fresh vegetables"",""tones"":[""falling"",""falling"",""rising"",""low"",""low""],""romanization"":""mâe lûeak sǔe phàk sòt""},{""thai"":""แทนที่จะ"",""english"":""instead of"",""tones"":[""falling"",""falling"",""low""],""grammar"":true,""romanization"":""thâen thî jà""},{""thai"":""ซื้ออาหารสำเร็จรูป"",""english"":""buying processed food"",""tones"":[""rising"",""rising"",""low"",""high""],""romanization"":""sǔe ahǎan samrèt rúup""}]",medium
เขาตัดสินใจกลับบ้านแทนที่จะอยู่ต่อ,khǎo tàdsǐnjaai glàp bâan thâen thî jà yùu tò,He decided to go home instead of staying longer.,"[{""thai"":""เขาตัดสินใจ"",""english"":""he decided"",""romanization"":""khǎo tàdsǐnjaai""},{""thai"":""กลับบ้าน"",""english"":""to go home"",""tones"":[""low"",""falling""],""romanization"":""glàp bâan""},{""thai"":""แทนที่จะ"",""english"":""instead of"",""tones"":[""falling"",""falling"",""low""],""grammar"":true,""romanization"":""thâen thî jà""},{""thai"":""อยู่ต่อ"",""english"":""staying longer"",""tones"":[""low"",""low""],""romanization"":""yùu tò""}]",medium
เธอเลือกนั่งสมาธิแทนที่จะดื่มกาแฟ,thoe lûeak nâng samâathi thâen thî jà dùem gaafae,She chose to meditate instead of drinking coffee.,"[{""thai"":""เธอเลือกนั่งสมาธิ"",""english"":""she chose to meditate"",""romanization"":""thoe lûeak nâng samâathi""},{""thai"":""แทนที่จะ"",""english"":""instead of"",""tones"":[""falling"",""falling"",""low""],""grammar"":true,""romanization"":""thâen thî jà""},{""thai"":""ดื่มกาแฟ"",""english"":""drinking coffee"",""romanization"":""dùem gaafae""}]",medium
ฉันดื่มน้ำแทนที่จะสั่งชาเย็น,chǎn dʉ̀ʉm náam thaaen-thîi-jà sàng chaa-yen,I drank water instead of ordering iced tea.,"[{""thai"":""ฉัน"",""english"":""I"",""tones"":[""rising""],""tone"":""rising"",""romanization"":""chǎn""},{""thai"":""ดื่ม"",""english"":""drink"",""tones"":[""low""],""tone"":""low"",""romanization"":""dʉ̀ʉm""},{""thai"":""น้ำ"",""english"":""water"",""tones"":[""high""],""tone"":""high"",""romanization"":""náam""},{""thai"":""แทนที่จะ"",""english"":""instead of"",""tones"":[""mid"",""falling"",""low""],""grammar"":true,""romanization"":""thaaen-thîi-jà""},{""thai"":""สั่ง"",""english"":""order"",""tones"":[""low""],""tone"":""low"",""romanization"":""sàng""},{""thai"":""ชาเย็น"",""english"":""iced tea"",""tones"":[""mid"",""mid""],""romanization"":""chaa-yen""}]",easy
เรานั่งรถไฟแทนที่จะขับรถ,rao nâng rót-fai thaaen-thîi-jà khàp rót,We took the train instead of driving.,"[{""thai"":""เรา"",""english"":""we"",""tones"":[""mid""],""tone"":""mid"",""romanization"":""rao""},{""thai"":""นั่ง"",""english"":""take / ride"",""tones"":[""falling""],""tone"":""falling"",""romanization"":""nâng""},{""thai"":""รถไฟ"",""english"":""train"",""tones"":[""high"",""mid""],""romanization"":""rót-fai""},{""thai"":""แทนที่จะ"",""english"":""instead of"",""tones"":[""mid"",""falling"",""low""],""grammar"":true,""romanization"":""thaaen-thîi-jà""},{""thai"":""ขับ"",""english"":""drive"",""tones"":[""low""],""tone"":""low"",""romanization"":""khàp""},{""thai"":""รถ"",""english"":""car"",""tones"":[""high""],""tone"":""high"",""romanization"":""rót""}]",easy
เขาอยู่บ้านแทนที่จะออกไปข้างนอก,khǎo yùu bâan thaaen-thîi-jà òk-bpai khâang-nâwk,He stayed home instead of going out.,"[{""thai"":""เขา"",""english"":""he"",""tones"":[""rising""],""tone"":""rising"",""romanization"":""khǎo""},{""thai"":""อยู่"",""english"":""stay"",""tones"":[""low""],""tone"":""low"",""romanization"":""yùu""},{""thai"":""บ้าน"",""english"":""home"",""tones"":[""falling""],""tone"":""falling"",""romanization"":""bâan""},{""thai"":""แทนที่จะ"",""english"":""instead of"",""tones"":[""mid"",""falling"",""low""],""grammar"":true,""romanization"":""thaaen-thîi-jà""},{""thai"":""ออกไป"",""english"":""go out"",""tones"":[""low"",""mid""],""romanization"":""òk-bpai""},{""thai"":""ข้างนอก"",""english"":""outside"",""tones"":[""falling"",""falling""],""romanization"":""khâang-nâwk""}]",easy
แม่ทำกับข้าวเองแทนที่จะซื้อกลับมา,mâae tham gàp-khâao eeng thaaen-thîi-jà sʉ́ʉ glàp-maa,Mom cooked herself instead of buying food to bring home.,"[{""thai"":""แม่"",""english"":""Mom"",""tones"":[""falling""],""tone"":""falling"",""romanization"":""mâae""},{""thai"":""ทำกับข้าว"",""english"":""cook"",""tones"":[""mid"",""low"",""falling""],""romanization"":""tham gàp-khâao""},{""thai"":""เอง"",""english"":""oneself"",""tones"":[""mid""],""tone"":""mid"",""romanization"":""eeng""},{""thai"":""แทนที่จะ"",""english"":""instead of"",""tones"":[""mid"",""falling"",""low""],""grammar"":true,""romanization"":""thaaen-thîi-jà""},{""thai"":""ซื้อ"",""english"":""buy"",""tones"":[""high""],""tone"":""high"",""romanization"":""sʉ́ʉ""},{""thai"":""กลับมา"",""english"":""bring back"",""tones"":[""low"",""mid""],""romanization"":""glàp-maa""}]",medium
พ่อเดินขึ้นบันไดแทนที่จะใช้ลิฟต์,phâaw dəən khʉ̂n ban-dai thaaen-thîi-jà chái lift,Dad took the stairs instead of using the elevator.,"[{""thai"":""พ่อ"",""english"":""Dad"",""tones"":[""falling""],""tone"":""falling"",""romanization"":""phâaw""},{""thai"":""เดินขึ้นบันได"",""english"":""take the stairs"",""tones"":[""mid"",""falling"",""mid"",""mid""],""romanization"":""dəən khʉ̂n ban-dai""},{""thai"":""แทนที่จะ"",""english"":""instead of"",""tones"":[""mid"",""falling"",""low""],""grammar"":true,""romanization"":""thaaen-thîi-jà""},{""thai"":""ใช้"",""english"":""use"",""tones"":[""high""],""tone"":""high"",""romanization"":""chái""},{""thai"":""ลิฟต์"",""english"":""elevator"",""tones"":[""high""],""tone"":""high"",""romanization"":""lift""}]",easy
ฉันโทรหาเขาแทนที่จะส่งข้อความ,chǎn thoo-hǎa khǎo thaaen-thîi-jà sòng khâaw-khwaam,I called him instead of sending a message.,"[{""thai"":""ฉัน"",""english"":""I"",""tones"":[""rising""],""tone"":""rising"",""romanization"":""chǎn""},{""thai"":""โทรหา"",""english"":""call"",""tones"":[""mid"",""rising""],""romanization"":""thoo-hǎa""},{""thai"":""เขา"",""english"":""him"",""tones"":[""rising""],""tone"":""rising"",""romanization"":""khǎo""},{""thai"":""แทนที่จะ"",""english"":""instead of"",""tones"":[""mid"",""falling"",""low""],""grammar"":true,""romanization"":""thaaen-thîi-jà""},{""thai"":""ส่ง"",""english"":""send"",""tones"":[""low""],""tone"":""low"",""romanization"":""sòng""},{""thai"":""ข้อความ"",""english"":""message"",""tones"":[""falling"",""mid""],""romanization"":""khâaw-khwaam""}]",easy
เขาอ่านข่าวแทนที่จะดูทีวี,khǎo àan khàao thaaen-thîi-jà duu thii-wii,He read the news instead of watching TV.,"[{""thai"":""เขา"",""english"":""he"",""tones"":[""rising""],""tone"":""rising"",""romanization"":""khǎo""},{""thai"":""อ่าน"",""english"":""read"",""tones"":[""low""],""tone"":""low"",""romanization"":""àan""},{""thai"":""ข่าว"",""english"":""news"",""tones"":[""low""],""tone"":""low"",""romanization"":""khàao""},{""thai"":""แทนที่จะ"",""english"":""instead of"",""tones"":[""mid"",""falling"",""low""],""grammar"":true,""romanization"":""thaaen-thîi-jà""},{""thai"":""ดู"",""english"":""watch"",""tones"":[""mid""],""tone"":""mid"",""romanization"":""duu""},{""thai"":""ทีวี"",""english"":""TV"",""tones"":[""mid"",""mid""],""romanization"":""thii-wii""}]",easy
ฉันพักกลางวันแทนที่จะทำงานต่อ,chǎn phák glaang-wan thaaen-thîi-jà tham-ngaan dtò,I took a lunch break instead of continuing to work.,"[{""thai"":""ฉัน"",""english"":""I"",""tones"":[""rising""],""tone"":""rising"",""romanization"":""chǎn""},{""thai"":""พักกลางวัน"",""english"":""take a lunch break"",""tones"":[""high"",""mid"",""mid""],""romanization"":""phák glaang-wan""},{""thai"":""แทนที่จะ"",""english"":""instead of"",""tones"":[""mid"",""falling"",""low""],""grammar"":true,""romanization"":""thaaen-thîi-jà""},{""thai"":""ทำงานต่อ"",""english"":""continue working"",""tones"":[""mid"",""mid"",""low""],""romanization"":""tham-ngaan dtò""}]",medium
เรากินที่บ้านแทนที่จะออกไปกินข้างนอก,rao gin thîi bâan thaaen-thîi-jà òk-bpai gin khâang-nâwk,We ate at home instead of eating out.,"[{""thai"":""เรา"",""english"":""we"",""tones"":[""mid""],""tone"":""mid"",""romanization"":""rao""},{""thai"":""กิน"",""english"":""eat"",""tones"":[""mid""],""tone"":""mid"",""romanization"":""gin""},{""thai"":""ที่"",""english"":""at"",""tones"":[""falling""],""tone"":""falling"",""romanization"":""thîi""},{""thai"":""บ้าน"",""english"":""home"",""tones"":[""falling""],""tone"":""falling"",""romanization"":""bâan""},{""thai"":""แทนที่จะ"",""english"":""instead of"",""tones"":[""mid"",""falling"",""low""],""grammar"":true,""romanization"":""thaaen-thîi-jà""},{""thai"":""ออกไป"",""english"":""go out"",""tones"":[""low"",""mid""],""romanization"":""òk-bpai""},{""thai"":""กิน"",""english"":""eat"",""tones"":[""mid""],""tone"":""mid"",""romanization"":""gin""},{""thai"":""ข้างนอก"",""english"":""outside"",""tones"":[""falling"",""falling""],""romanization"":""khâang-nâwk""}]",easy
