thai,romanization,english,breakdown,difficulty
แม่อยู่บ้าน,mae yu ban,Mom is at home.,"[{""thai"":""แม่"",""english"":""mom"",""tone"":""falling""},{""thai"":""อยู่"",""english"":""be located"",""tone"":""low"",""grammar"":true},{""thai"":""บ้าน"",""english"":""home"",""tone"":""falling""}]",easy
พ่ออยู่โรงเรียน,pho yu rongrian,Dad is at school.,"[{""thai"":""พ่อ"",""english"":""dad"",""tone"":""falling""},{""thai"":""อยู่"",""english"":""be located"",""tone"":""low"",""grammar"":true},{""thai"":""โรงเรียน"",""english"":""school"",""tone"":""mid""}]",easy
เขาอยู่กรุงเทพฯ,khao yu Krungthep,He is in Bangkok.,"[{""thai"":""เขา"",""english"":""he / she"",""tone"":""rising""},{""thai"":""อยู่"",""english"":""be located"",""tone"":""low"",""grammar"":true},{""thai"":""กรุงเทพฯ"",""english"":""Bangkok"",""tone"":""mid""}]",easy
ฉันอยู่ที่ทำงาน,chan yu thi thamngan,I am at work.,"[{""thai"":""ฉัน"",""english"":""I"",""tone"":""mid""},{""thai"":""อยู่"",""english"":""am"",""tone"":""mid"",""grammar"":true},{""thai"":""ที่"",""english"":""at"",""tone"":""mid""},{""thai"":""ทำงาน"",""english"":""work"",""tone"":""mid""}]",easy
เธออยู่ที่ร้านกาแฟ,ther yu thi ran kafe,She is at the coffee shop.,"[{""thai"":""เธอ"",""english"":""She"",""tone"":""mid""},{""thai"":""อยู่"",""english"":""is"",""tone"":""mid"",""grammar"":true},{""thai"":""ที่"",""english"":""at"",""tone"":""mid""},{""thai"":""ร้านกาแฟ"",""english"":""coffee shop"",""tone"":""mid""}]",easy
พวกเขาอยู่ที่สวน,phuak khao yu thi suan,They are at the park.,"[{""thai"":""พวกเขา"",""english"":""They"",""tone"":""mid""},{""thai"":""อยู่"",""english"":""are"",""tone"":""mid"",""grammar"":true},{""thai"":""ที่"",""english"":""at"",""tone"":""mid""},{""thai"":""สวน"",""english"":""park"",""tone"":""mid""}]",easy
คุณอยู่ที่ห้องเรียน,khun yu thi hongrian,You are in the classroom.,"[{""thai"":""คุณ"",""english"":""You"",""tone"":""mid""},{""thai"":""อยู่"",""english"":""are"",""tone"":""mid"",""grammar"":true},{""thai"":""ที่"",""english"":""in"",""tone"":""mid""},{""thai"":""ห้องเรียน"",""english"":""classroom"",""tone"":""mid""}]",easy
เขาอยู่ที่บ้านเพื่อน,khao yu thi ban phuean,He is at a friend's house.,"[{""thai"":""เขา"",""english"":""He"",""tone"":""mid""},{""thai"":""อยู่"",""english"":""is"",""tone"":""mid"",""grammar"":true},{""thai"":""ที่"",""english"":""at"",""tone"":""mid""},{""thai"":""บ้านเพื่อน"",""english"":""friend's house"",""tone"":""mid""}]",easy
มีแมวอยู่บนโต๊ะ,mi maeo yu bon to,There is a cat on the table.,"[{""thai"":""มี"",""english"":""There is"",""tone"":""mid""},{""thai"":""แมว"",""english"":""a cat"",""tone"":""mid""},{""thai"":""อยู่"",""english"":""on"",""tone"":""mid"",""grammar"":true},{""thai"":""บน"",""english"":""on"",""tone"":""mid""},{""thai"":""โต๊ะ"",""english"":""table"",""tone"":""mid""}]",medium
พี่ชายอยู่ที่ห้องน้ำ,phi chai yu thi hongnam,Big brother is in the bathroom.,"[{""thai"":""พี่ชาย"",""english"":""Big brother"",""tone"":""mid""},{""thai"":""อยู่"",""english"":""is"",""tone"":""mid"",""grammar"":true},{""thai"":""ที่"",""english"":""in"",""tone"":""mid""},{""thai"":""ห้องน้ำ"",""english"":""bathroom"",""tone"":""mid""}]",easy
เด็กๆอยู่ที่สนามเด็กเล่น,dek-dek yu thi sanam deklen,The kids are at the playground.,"[{""thai"":""เด็กๆ"",""english"":""The kids"",""tone"":""mid""},{""thai"":""อยู่"",""english"":""are"",""tone"":""mid"",""grammar"":true},{""thai"":""ที่"",""english"":""at"",""tone"":""mid""},{""thai"":""สนามเด็กเล่น"",""english"":""playground"",""tone"":""mid""}]",easy
เขาอยู่ที่สนามบิน,khao yu thi sanambin,He is at the airport.,"[{""thai"":""เขา"",""english"":""He"",""tone"":""mid""},{""thai"":""อยู่"",""english"":""is"",""tone"":""mid"",""grammar"":true},{""thai"":""ที่"",""english"":""at"",""tone"":""mid""},{""thai"":""สนามบิน"",""english"":""airport"",""tone"":""mid""}]",easy
แม่อยู่ที่ตลาด,mae yu thi talat,Mom is at the market.,"[{""thai"":""แม่"",""english"":""Mom"",""tone"":""mid""},{""thai"":""อยู่"",""english"":""is"",""tone"":""mid"",""grammar"":true},{""thai"":""ที่"",""english"":""at"",""tone"":""mid""},{""thai"":""ตลาด"",""english"":""market"",""tone"":""mid""}]",easy
เขาอยู่ที่ห้องสมุด,khao yu thi hongsamut,He is at the library.,"[{""thai"":""เขา"",""english"":""He"",""tone"":""mid""},{""thai"":""อยู่"",""english"":""is"",""tone"":""mid"",""grammar"":true},{""thai"":""ที่"",""english"":""at"",""tone"":""mid""},{""thai"":""ห้องสมุด"",""english"":""library"",""tone"":""mid""}]",easy
เรานั่งอยู่ที่โซฟา,rao nang yu thi sofa,We are sitting on the sofa.,"[{""thai"":""เรา"",""english"":""We"",""tone"":""mid""},{""thai"":""นั่ง"",""english"":""are sitting"",""tone"":""mid""},{""thai"":""อยู่"",""english"":""on"",""tone"":""mid"",""grammar"":true},{""thai"":""ที่"",""english"":""on"",""tone"":""mid""},{""thai"":""โซฟา"",""english"":""sofa"",""tone"":""mid""}]",medium
รถอยู่ที่โรงรถ,rot yu thi rongrot,The car is in the garage.,"[{""thai"":""รถ"",""english"":""The car"",""tone"":""mid""},{""thai"":""อยู่"",""english"":""is"",""tone"":""mid"",""grammar"":true},{""thai"":""ที่"",""english"":""in"",""tone"":""mid""},{""thai"":""โรงรถ"",""english"":""garage"",""tone"":""mid""}]",medium
สัตว์อยู่ในป่า,sat yu nai pa,The animals are in the forest.,"[{""thai"":""สัตว์"",""english"":""The animals"",""tone"":""mid""},{""thai"":""อยู่"",""english"":""are"",""tone"":""mid"",""grammar"":true},{""thai"":""ใน"",""english"":""in"",""tone"":""mid""},{""thai"":""ป่า"",""english"":""forest"",""tone"":""mid""}]",medium
หนังสืออยู่บนชั้น,nangsue yu bon chan,The book is on the shelf.,"[{""thai"":""หนังสือ"",""english"":""The book"",""tone"":""mid""},{""thai"":""อยู่"",""english"":""is"",""tone"":""mid"",""grammar"":true},{""thai"":""บน"",""english"":""on"",""tone"":""mid""},{""thai"":""ชั้น"",""english"":""shelf"",""tone"":""mid""}]",medium
ปลาอยู่ในน้ำ,pla yu nai nam,The fish is in the water.,"[{""thai"":""ปลา"",""english"":""The fish"",""tone"":""mid""},{""thai"":""อยู่"",""english"":""is"",""tone"":""mid"",""grammar"":true},{""thai"":""ใน"",""english"":""in"",""tone"":""mid""},{""thai"":""น้ำ"",""english"":""water"",""tone"":""mid""}]",medium
พวกเขาอยู่ในเมือง,phuak khao yu nai mueang,They are in the city.,"[{""thai"":""พวกเขา"",""english"":""They"",""tone"":""mid""},{""thai"":""อยู่"",""english"":""are"",""tone"":""mid"",""grammar"":true},{""thai"":""ใน"",""english"":""in"",""tone"":""mid""},{""thai"":""เมือง"",""english"":""city"",""tone"":""mid""}]",hard
เราอยู่ที่นี่,rao yu thi ni,We are here.,"[{""thai"":""เรา"",""english"":""We"",""tone"":""mid""},{""thai"":""อยู่"",""english"":""are"",""tone"":""mid"",""grammar"":true},{""thai"":""ที่นี่"",""english"":""here"",""tone"":""mid""}]",easy
หนูอยู่ที่บ้าน,nu yu thi ban,The mouse is at home.,"[{""thai"":""หนู"",""english"":""The mouse"",""tone"":""mid""},{""thai"":""อยู่"",""english"":""is"",""tone"":""mid"",""grammar"":true},{""thai"":""ที่"",""english"":""at"",""tone"":""mid""},{""thai"":""บ้าน"",""english"":""home"",""tone"":""mid""}]",easy
เขาอยู่ที่ห้องนอน,khao yu thi hongnon,He is in the bedroom.,"[{""thai"":""เขา"",""english"":""He"",""tone"":""mid""},{""thai"":""อยู่"",""english"":""is"",""tone"":""mid"",""grammar"":true},{""thai"":""ที่"",""english"":""in"",""tone"":""mid""},{""thai"":""ห้องนอน"",""english"":""the bedroom"",""tone"":""mid""}]",easy
เธออยู่ที่บ้านเพื่อน,ther yu thi ban phuean,She is at a friend's house.,"[{""thai"":""เธอ"",""english"":""She"",""tone"":""mid""},{""thai"":""อยู่"",""english"":""is"",""tone"":""mid"",""grammar"":true},{""thai"":""ที่"",""english"":""at"",""tone"":""mid""},{""thai"":""บ้านเพื่อน"",""english"":""friend's house"",""tone"":""mid""}]",easy
ฉันอยู่ที่ตลาดนัด,chan yu thi taladnat,I am at the market.,"[{""thai"":""ฉัน"",""english"":""I"",""tone"":""mid""},{""thai"":""อยู่"",""english"":""am"",""tone"":""mid"",""grammar"":true},{""thai"":""ที่"",""english"":""at"",""tone"":""mid""},{""thai"":""ตลาดนัด"",""english"":""the market"",""tone"":""mid""}]",easy
รถอยู่ในโรงรถ,rot yu nai rong rot,The car is in the garage.,"[{""thai"":""รถ"",""english"":""The car"",""tone"":""mid""},{""thai"":""อยู่"",""english"":""is"",""tone"":""mid"",""grammar"":true},{""thai"":""ใน"",""english"":""in"",""tone"":""mid""},{""thai"":""โรงรถ"",""english"":""the garage"",""tone"":""mid""}]",easy
เราอยู่ที่โรงเรียนสอนภาษา,rao yu thi rongrian son phasa,We are at the language school.,"[{""thai"":""เรา"",""english"":""We"",""tone"":""mid""},{""thai"":""อยู่"",""english"":""are"",""tone"":""mid"",""grammar"":true},{""thai"":""ที่"",""english"":""at"",""tone"":""mid""},{""thai"":""โรงเรียนสอนภาษา"",""english"":""the language school"",""tone"":""mid""}]",easy
สุนัขอยู่ในสวน,sunak yu nai suan,The dog is in the garden.,"[{""thai"":""สุนัข"",""english"":""The dog"",""tone"":""mid""},{""thai"":""อยู่"",""english"":""is"",""tone"":""mid"",""grammar"":true},{""thai"":""ใน"",""english"":""in"",""tone"":""mid""},{""thai"":""สวน"",""english"":""the garden"",""tone"":""mid""}]",easy
พวกเขาอยู่ที่ห้องประชุม,phuak khao yu thi hong prachum,They are in the meeting room.,"[{""thai"":""พวกเขา"",""english"":""They"",""tone"":""mid""},{""thai"":""อยู่"",""english"":""are"",""tone"":""mid"",""grammar"":true},{""thai"":""ที่"",""english"":""in"",""tone"":""mid""},{""thai"":""ห้องประชุม"",""english"":""the meeting room"",""tone"":""mid""}]",medium
นกอยู่บนต้นไม้,nok yu bon tonmai,The bird is on the tree.,"[{""thai"":""นก"",""english"":""The bird"",""tone"":""mid""},{""thai"":""อยู่"",""english"":""is"",""tone"":""mid"",""grammar"":true},{""thai"":""บน"",""english"":""on"",""tone"":""mid""},{""thai"":""ต้นไม้"",""english"":""the tree"",""tone"":""mid""}]",easy
หลานอยู่ที่บ้าน,lan yu thi ban,The niece is at home.,"[{""thai"":""หลาน"",""english"":""The niece"",""tone"":""mid""},{""thai"":""อยู่"",""english"":""is"",""tone"":""mid"",""grammar"":true},{""thai"":""ที่"",""english"":""at"",""tone"":""mid""},{""thai"":""บ้าน"",""english"":""home"",""tone"":""mid""}]",easy
คุณอยู่ที่ห้องสมุด,khun yu thi hong samut,You are at the library.,"[{""thai"":""คุณ"",""english"":""You"",""tone"":""mid""},{""thai"":""อยู่"",""english"":""are"",""tone"":""mid"",""grammar"":true},{""thai"":""ที่"",""english"":""at"",""tone"":""mid""},{""thai"":""ห้องสมุด"",""english"":""the library"",""tone"":""mid""}]",easy
เพื่อนอยู่ที่หอพัก,phuean yu thi ho phak,A friend is at the dorm.,"[{""thai"":""เพื่อน"",""english"":""A friend"",""tone"":""mid""},{""thai"":""อยู่"",""english"":""is"",""tone"":""mid"",""grammar"":true},{""thai"":""ที่"",""english"":""at"",""tone"":""mid""},{""thai"":""หอพัก"",""english"":""the dorm"",""tone"":""mid""}]",easy
เด็กอยู่ที่สนามกีฬา,dek yu thi sanam kila,The child is at the sports field.,"[{""thai"":""เด็ก"",""english"":""The child"",""tone"":""mid""},{""thai"":""อยู่"",""english"":""is"",""tone"":""mid"",""grammar"":true},{""thai"":""ที่"",""english"":""at"",""tone"":""mid""},{""thai"":""สนามกีฬา"",""english"":""the sports field"",""tone"":""mid""}]",medium
แกอยู่ที่ห้องครัว,kae yu thi hong khrua,She is in the kitchen.,"[{""thai"":""แก"",""english"":""She"",""tone"":""mid""},{""thai"":""อยู่"",""english"":""is"",""tone"":""mid"",""grammar"":true},{""thai"":""ที่"",""english"":""in"",""tone"":""mid""},{""thai"":""ห้องครัว"",""english"":""the kitchen"",""tone"":""mid""}]",easy
เด็กๆอยู่ที่ห้องเรียน,dek-dek yu thi hongrian,The kids are in the classroom.,"[{""thai"":""เด็กๆ"",""english"":""The kids"",""tone"":""mid""},{""thai"":""อยู่"",""english"":""are"",""tone"":""mid"",""grammar"":true},{""thai"":""ที่"",""english"":""in"",""tone"":""mid""},{""thai"":""ห้องเรียน"",""english"":""the classroom"",""tone"":""mid""}]",easy
แม่อยู่ที่ร้านอาหาร,mae yu thi ran ahan,Mom is at the restaurant.,"[{""thai"":""แม่"",""english"":""Mom"",""tone"":""mid""},{""thai"":""อยู่"",""english"":""is"",""tone"":""mid"",""grammar"":true},{""thai"":""ที่"",""english"":""at"",""tone"":""mid""},{""thai"":""ร้านอาหาร"",""english"":""the restaurant"",""tone"":""mid""}]",easy
นักเรียนอยู่ที่ห้องทดลอง,nakrian yu thi hong thukhlaw,The student is in the laboratory.,"[{""thai"":""นักเรียน"",""english"":""The student"",""tone"":""mid""},{""thai"":""อยู่"",""english"":""is"",""tone"":""mid"",""grammar"":true},{""thai"":""ที่"",""english"":""in"",""tone"":""mid""},{""thai"":""ห้องทดลอง"",""english"":""the laboratory"",""tone"":""mid""}]",medium
น้องอยู่ที่ห้องพัก,nong yu thi hong phak,The younger sibling is at the room.,"[{""thai"":""น้อง"",""english"":""The younger sibling"",""tone"":""mid""},{""thai"":""อยู่"",""english"":""is"",""tone"":""mid"",""grammar"":true},{""thai"":""ที่"",""english"":""at"",""tone"":""mid""},{""thai"":""ห้องพัก"",""english"":""the room"",""tone"":""mid""}]",easy
คุณยายอยู่ที่สวนสาธารณะ,khunyaai yu thi suan satharana,Grandma is at the park.,"[{""thai"":""คุณยาย"",""english"":""Grandma"",""tone"":""mid""},{""thai"":""อยู่"",""english"":""is"",""tone"":""mid"",""grammar"":true},{""thai"":""ที่"",""english"":""at"",""tone"":""mid""},{""thai"":""สวนสาธารณะ"",""english"":""the park"",""tone"":""mid""}]",easy
เพื่อนอยู่ในบ้าน,phuean yu nai ban,A friend is in the house.,"[{""thai"":""เพื่อน"",""english"":""A friend"",""tone"":""mid""},{""thai"":""อยู่"",""english"":""is"",""tone"":""mid"",""grammar"":true},{""thai"":""ใน"",""english"":""in"",""tone"":""mid""},{""thai"":""บ้าน"",""english"":""the house"",""tone"":""mid""}]",easy
คุณอยู่ในห้องน้ำ,khun yu nai hongnam,You are in the bathroom.,"[{""thai"":""คุณ"",""english"":""You"",""tone"":""mid""},{""thai"":""อยู่"",""english"":""are"",""tone"":""mid"",""grammar"":true},{""thai"":""ใน"",""english"":""in"",""tone"":""mid""},{""thai"":""ห้องน้ำ"",""english"":""the bathroom"",""tone"":""mid""}]",easy
พี่ชายอยู่ที่ร้านหนังสือ,phichai yu thi ran nangsue,The older brother is at the bookstore.,"[{""thai"":""พี่ชาย"",""english"":""The older brother"",""tone"":""mid""},{""thai"":""อยู่"",""english"":""is"",""tone"":""mid"",""grammar"":true},{""thai"":""ที่"",""english"":""at"",""tone"":""mid""},{""thai"":""ร้านหนังสือ"",""english"":""the bookstore"",""tone"":""mid""}]",medium
เขาอยู่ที่ฟาร์ม,khao yu thi farm,He is at the farm.,"[{""thai"":""เขา"",""english"":""He"",""tone"":""mid""},{""thai"":""อยู่"",""english"":""is"",""tone"":""mid"",""grammar"":true},{""thai"":""ที่"",""english"":""at"",""tone"":""mid""},{""thai"":""ฟาร์ม"",""english"":""the farm"",""tone"":""mid""}]",easy
เด็กอยู่ที่บ้านยาย,dek yu thi ban yai,The kid is at grandma's house.,"[{""thai"":""เด็ก"",""english"":""The kid"",""tone"":""mid""},{""thai"":""อยู่"",""english"":""is"",""tone"":""mid"",""grammar"":true},{""thai"":""ที่บ้านยาย"",""english"":""at grandma's house"",""tone"":""mid""}]",easy
เพื่อนอยู่ที่ห้องนั่งเล่น,phuean yu thi hong nanglen,A friend is in the living room.,"[{""thai"":""เพื่อน"",""english"":""A friend"",""tone"":""mid""},{""thai"":""อยู่"",""english"":""is"",""tone"":""mid"",""grammar"":true},{""thai"":""ที่ห้องนั่งเล่น"",""english"":""in the living room"",""tone"":""mid""}]",easy
แมวอยู่ในกล่อง,maeo yu nai klong,The cat is in the box.,"[{""thai"":""แมว"",""english"":""The cat"",""tone"":""mid""},{""thai"":""อยู่"",""english"":""is"",""tone"":""mid"",""grammar"":true},{""thai"":""ในกล่อง"",""english"":""in the box"",""tone"":""mid""}]",easy
เขาอยู่ที่ร้านอาหารญี่ปุ่น,khao yu thi ran arhan yipun,He is at the Japanese restaurant.,"[{""thai"":""เขา"",""english"":""He"",""tone"":""mid""},{""thai"":""อยู่"",""english"":""is"",""tone"":""mid"",""grammar"":true},{""thai"":""ที่ร้านอาหารญี่ปุ่น"",""english"":""at the Japanese restaurant"",""tone"":""mid""}]",medium
น้องสาวอยู่ที่วิทยาลัย,nong sao yu thi witthayalai,My sister is at the college.,"[{""thai"":""น้องสาว"",""english"":""My sister"",""tone"":""mid""},{""thai"":""อยู่"",""english"":""is"",""tone"":""mid"",""grammar"":true},{""thai"":""ที่วิทยาลัย"",""english"":""at the college"",""tone"":""mid""}]",medium
รถอยู่ที่ปั๊มน้ำมัน,rot yu thi pam namman,The car is at the gas station.,"[{""thai"":""รถ"",""english"":""The car"",""tone"":""mid""},{""thai"":""อยู่"",""english"":""is"",""tone"":""mid"",""grammar"":true},{""thai"":""ที่ปั๊มน้ำมัน"",""english"":""at the gas station"",""tone"":""mid""}]",hard