thai,romanization,english,breakdown,difficulty
การฟังให้จบก่อนตอบช่วยมาก,kaan fang hai jop kon top chuai maak,Listening to the end before answering helps a lot.,"[{""thai"":""การ"",""english"":""the act of"",""tones"":[""mid""],""tone"":""mid"",""grammar"":true,""romanization"":""kaan""},{""thai"":""ฟังให้จบก่อนตอบ"",""english"":""listen to the end before answering"",""tones"":[""mid"",""falling"",""low"",""low"",""high""],""romanization"":""fang hai jop kon top""},{""thai"":""ช่วยมาก"",""english"":""helps a lot"",""tones"":[""falling"",""falling""],""romanization"":""chuai maak""}]",medium
ความเร็วอย่างเดียวไม่พอสำหรับงานนี้,khwaam reo yaang diao mai pho samrap ngaan nii,Speed alone isn't enough for this job.,"[{""thai"":""ความ"",""english"":""abstract noun marker"",""tones"":[""mid""],""tone"":""mid"",""grammar"":true,""romanization"":""khwaam""},{""thai"":""เร็ว"",""english"":""speed / fast"",""tones"":[""mid""],""tone"":""mid"",""romanization"":""reo""},{""thai"":""อย่างเดียว"",""english"":""alone"",""tones"":[""low"",""mid""],""romanization"":""yaang diao""},{""thai"":""ไม่พอ"",""english"":""not enough"",""tones"":[""falling"",""mid""],""romanization"":""mai pho""},{""thai"":""สำหรับงานนี้"",""english"":""for this job"",""tones"":[""rising"",""low"",""mid"",""high""],""romanization"":""samrap ngaan nii""}]",medium
การเตรียมเอกสารไว้ล่วงหน้าทำให้วันนั้นง่ายขึ้น,kaan triiam ekasaan wai luang naa tham hai wan nan ngaai khuen,Preparing the documents in advance made that day easier.,"[{""thai"":""การ"",""english"":""the act of"",""tones"":[""mid""],""tone"":""mid"",""grammar"":true,""romanization"":""kaan""},{""thai"":""เตรียมเอกสารไว้ล่วงหน้า"",""english"":""prepare the documents in advance"",""tones"":[""mid"",""low"",""low"",""rising"",""high"",""falling"",""falling""],""romanization"":""triiam ekasaan wai luang naa""},{""thai"":""ทำให้"",""english"":""make"",""tones"":[""mid"",""falling""],""romanization"":""tham hai""},{""thai"":""วันนั้นง่ายขึ้น"",""english"":""that day easier"",""tones"":[""mid"",""high"",""falling"",""falling""],""romanization"":""wan nan ngaai khuen""}]",medium
ความมั่นใจของเขาดูดีขึ้นมาก,khwaam manjai khong khao duu dii khuen maak,His confidence looks much better.,"[{""thai"":""ความ"",""english"":""abstract noun marker"",""tones"":[""mid""],""tone"":""mid"",""grammar"":true,""romanization"":""khwaam""},{""thai"":""มั่นใจ"",""english"":""confidence"",""tones"":[""falling"",""mid""],""romanization"":""manjai""},{""thai"":""ของเขา"",""english"":""his"",""tones"":[""rising"",""rising""],""romanization"":""khong khao""},{""thai"":""ดูดีขึ้นมาก"",""english"":""looks much better"",""tones"":[""mid"",""mid"",""falling"",""falling""],""romanization"":""duu dii khuen maak""}]",easy
การขอโทษทันทีลดปัญหาได้เยอะ,kaan khothot thanthii lot panhaa dai yoe,Apologizing right away can reduce problems a lot.,"[{""thai"":""การ"",""english"":""the act of"",""tones"":[""mid""],""tone"":""mid"",""grammar"":true,""romanization"":""kaan""},{""thai"":""ขอโทษทันที"",""english"":""apologize right away"",""tones"":[""rising"",""falling"",""mid"",""mid""],""romanization"":""khothot thanthii""},{""thai"":""ลดปัญหา"",""english"":""reduce problems"",""tones"":[""high"",""rising"",""rising""],""romanization"":""lot panhaa""},{""thai"":""ได้เยอะ"",""english"":""a lot / can a lot"",""tones"":[""falling"",""high""],""romanization"":""dai yoe""}]",medium
ความกดดันช่วงนี้สูงกว่าปกติ,khwaam kotdan chuang nii suung kwaa pokkati,The pressure lately is higher than usual.,"[{""thai"":""ความ"",""english"":""abstract noun marker"",""tones"":[""mid""],""tone"":""mid"",""grammar"":true,""romanization"":""khwaam""},{""thai"":""กดดัน"",""english"":""pressure"",""tones"":[""low"",""mid""],""romanization"":""kotdan""},{""thai"":""ช่วงนี้"",""english"":""lately"",""tones"":[""mid"",""high""],""romanization"":""chuang nii""},{""thai"":""สูงกว่าปกติ"",""english"":""higher than usual"",""tones"":[""rising"",""low"",""low"",""low"",""mid""],""romanization"":""suung kwaa pokkati""}]",medium
การตอบข้อความเร็วช่วยให้คุยงานง่ายขึ้น,kaan top khokhwaam reo chuai hai khui ngaan ngaai khuen,Replying quickly makes work conversations easier.,"[{""thai"":""การ"",""english"":""the act of"",""tones"":[""mid""],""tone"":""mid"",""grammar"":true,""romanization"":""kaan""},{""thai"":""ตอบข้อความเร็ว"",""english"":""reply quickly"",""tones"":[""high"",""low"",""mid"",""mid""],""romanization"":""top khokhwaam reo""},{""thai"":""ช่วยให้"",""english"":""helps make"",""tones"":[""falling"",""falling""],""romanization"":""chuai hai""},{""thai"":""คุยงานง่ายขึ้น"",""english"":""talking about work easier"",""tones"":[""mid"",""mid"",""falling"",""falling""],""romanization"":""khui ngaan ngaai khuen""}]",medium
ความจริงบางครั้งก็ฟังยาก,khwaam jing baang khrang ko fang yaak,The truth is sometimes hard to hear.,"[{""thai"":""ความ"",""english"":""abstract noun marker"",""tones"":[""mid""],""tone"":""mid"",""grammar"":true,""romanization"":""khwaam""},{""thai"":""จริง"",""english"":""truth / true"",""tones"":[""mid""],""tone"":""mid"",""romanization"":""jing""},{""thai"":""บางครั้งก็"",""english"":""sometimes"",""tones"":[""mid"",""high"",""falling""],""romanization"":""baang khrang ko""},{""thai"":""ฟังยาก"",""english"":""hard to hear"",""tones"":[""mid"",""falling""],""romanization"":""fang yaak""}]",easy
การแบ่งงานให้ชัดทำให้ทุกคนทำงานง่ายขึ้น,kaan baeng ngaan hai chat tham hai thuk khon thamngaan ngaai khuen,Dividing the work clearly makes it easier for everyone to work.,"[{""thai"":""การ"",""english"":""the act of"",""tones"":[""mid""],""tone"":""mid"",""grammar"":true,""romanization"":""kaan""},{""thai"":""แบ่งงานให้ชัด"",""english"":""divide the work clearly"",""tones"":[""low"",""mid"",""falling"",""high""],""romanization"":""baeng ngaan hai chat""},{""thai"":""ทำให้"",""english"":""make"",""tones"":[""mid"",""falling""],""romanization"":""tham hai""},{""thai"":""ทุกคนทำงานง่ายขึ้น"",""english"":""everyone work more easily"",""tones"":[""high"",""mid"",""mid"",""mid"",""falling"",""falling""],""romanization"":""thuk khon thamngaan ngaai khuen""}]",medium
ความปลอดภัยต้องมาก่อนเสมอ,khwaam plodphai tong maa kon samoe,Safety must always come first.,"[{""thai"":""ความ"",""english"":""abstract noun marker"",""tones"":[""mid""],""tone"":""mid"",""grammar"":true,""romanization"":""khwaam""},{""thai"":""ปลอดภัย"",""english"":""safety / safe"",""tones"":[""low"",""mid""],""romanization"":""plodphai""},{""thai"":""ต้องมาก่อนเสมอ"",""english"":""must always come first"",""tones"":[""falling"",""mid"",""low"",""rising""],""romanization"":""tong maa kon samoe""}]",easy
การกลับบ้านเร็ววันนี้น่าจะดีกว่า,kaan klap baan reo wannii naa cha dii kwaa,Going home early today is probably better.,"[{""thai"":""การ"",""english"":""the act of"",""tones"":[""mid""],""tone"":""mid"",""grammar"":true,""romanization"":""kaan""},{""thai"":""กลับบ้านเร็ววันนี้"",""english"":""go home early today"",""tones"":[""low"",""falling"",""mid"",""mid"",""high""],""romanization"":""klap baan reo wannii""},{""thai"":""น่าจะดีกว่า"",""english"":""is probably better"",""tones"":[""falling"",""low"",""mid"",""low""],""romanization"":""naa cha dii kwaa""}]",easy
ความกังวลของแม่ยังไม่หาย,khwaam kangwon khong mae yang mai haai,Mom's worry still hasn't gone away.,"[{""thai"":""ความ"",""english"":""abstract noun marker"",""tones"":[""mid""],""tone"":""mid"",""grammar"":true,""romanization"":""khwaam""},{""thai"":""กังวล"",""english"":""worry"",""tones"":[""mid"",""mid""],""romanization"":""kangwon""},{""thai"":""ของแม่"",""english"":""of Mom"",""tones"":[""rising"",""falling""],""romanization"":""khong mae""},{""thai"":""ยังไม่หาย"",""english"":""still hasn't gone away"",""tones"":[""mid"",""falling"",""rising""],""romanization"":""yang mai haai""}]",medium
การจดโน้ตช่วยให้ฉันจำได้ดีขึ้น,kaan jot not chuai hai chan jam dai dii khuen,Taking notes helps me remember better.,"[{""thai"":""การ"",""english"":""the act of"",""tones"":[""mid""],""tone"":""mid"",""grammar"":true,""romanization"":""kaan""},{""thai"":""จดโน้ต"",""english"":""take notes"",""tones"":[""low"",""high""],""romanization"":""jot not""},{""thai"":""ช่วยให้ฉัน"",""english"":""helps me"",""tones"":[""falling"",""falling"",""rising""],""romanization"":""chuai hai chan""},{""thai"":""จำได้ดีขึ้น"",""english"":""remember better"",""tones"":[""mid"",""falling"",""mid"",""falling""],""romanization"":""jam dai dii khuen""}]",easy
ความสม่ำเสมอสำคัญกว่าการรีบเริ่มแล้วเลิก,khwaam samer samoe samkhan kwaa kaan riip roem laeo loek,Consistency is more important than rushing to start and then quitting.,"[{""thai"":""ความ"",""english"":""abstract noun marker"",""tones"":[""mid""],""tone"":""mid"",""grammar"":true,""romanization"":""khwaam""},{""thai"":""สม่ำเสมอ"",""english"":""consistency"",""tones"":[""falling"",""rising"",""rising""],""romanization"":""samer samoe""},{""thai"":""สำคัญกว่า"",""english"":""more important than"",""tones"":[""rising"",""mid"",""low""],""romanization"":""samkhan kwaa""},{""thai"":""การรีบเริ่มแล้วเลิก"",""english"":""rushing to start and then quitting"",""tones"":[""mid"",""falling"",""falling"",""high"",""low""],""grammar"":true,""romanization"":""kaan riip roem laeo loek""}]",hard
การให้เวลาตัวเองพักบ้างไม่ใช่เรื่องผิด,kaan hai welaa tua eng phak baang mai chai rueang phit,Giving yourself time to rest sometimes isn't wrong.,"[{""thai"":""การ"",""english"":""the act of"",""tones"":[""mid""],""tone"":""mid"",""grammar"":true,""romanization"":""kaan""},{""thai"":""ให้เวลาตัวเองพักบ้าง"",""english"":""give yourself time to rest sometimes"",""tones"":[""falling"",""mid"",""mid"",""mid"",""high"",""mid""],""romanization"":""hai welaa tua eng phak baang""},{""thai"":""ไม่ใช่เรื่องผิด"",""english"":""isn't wrong"",""tones"":[""falling"",""falling"",""falling"",""low""],""romanization"":""mai chai rueang phit""}]",medium