thai,romanization,english,breakdown,difficulty
การวิ่งทุกวันทำให้สุขภาพดีขึ้น,kaan wîng thúk wan tham hâi sùk-khà-phâap dii khûen,Running every day improves health.,"[{""thai"":""การวิ่ง"",""english"":""Running"",""tone"":""mid"",""romanization"":""kaan wîng"",""grammar"":true},{""thai"":""ทุกวัน"",""english"":""every day"",""tone"":""high"",""romanization"":""thúk wan""},{""thai"":""ทำให้"",""english"":""makes"",""tone"":""falling"",""romanization"":""tham hâi""},{""thai"":""สุขภาพ"",""english"":""health"",""tone"":""low"",""romanization"":""sùk-khà-phâap""},{""thai"":""ดีขึ้น"",""english"":""better"",""tone"":""falling"",""romanization"":""dii khûen""}]",medium
ความรักทำให้คนมีความสุข,khwaam rák tham hâi khon mii khwaam sùk,Love makes people happy.,"[{""thai"":""ความรัก"",""english"":""Love"",""tone"":""mid"",""romanization"":""khwaam rák"",""grammar"":true},{""thai"":""ทำให้"",""english"":""makes"",""tone"":""falling"",""romanization"":""tham hâi""},{""thai"":""คน"",""english"":""people"",""tone"":""mid"",""romanization"":""khon""},{""thai"":""มี"",""english"":""have"",""tone"":""mid"",""romanization"":""mii""},{""thai"":""ความสุข"",""english"":""happiness"",""tone"":""low"",""romanization"":""khwaam sùk""}]",easy
การเรียนภาษาจีนยากกว่าภาษาอังกฤษ,kaan rian phaasǎa jiin yâak gwàa phaasǎa ang-grìt,Studying Chinese is more difficult than English.,"[{""thai"":""การเรียน"",""english"":""Studying"",""tone"":""mid"",""romanization"":""kaan rian"",""grammar"":true},{""thai"":""ภาษาจีน"",""english"":""Chinese language"",""tone"":""mid"",""romanization"":""phaasǎa jiin""},{""thai"":""ยากกว่า"",""english"":""more difficult than"",""tone"":""falling"",""romanization"":""yâak gwàa""},{""thai"":""ภาษาอังกฤษ"",""english"":""English language"",""tone"":""mid"",""romanization"":""phaasǎa ang-grìt""}]",hard
ความจริงคือสิ่งที่สำคัญที่สุด,khwaam jing khue sìng thîi sǎm-khan thîi sùt,Truth is the most important thing.,"[{""thai"":""ความจริง"",""english"":""Truth"",""tone"":""mid"",""romanization"":""khwaam jing"",""grammar"":true},{""thai"":""คือ"",""english"":""is"",""tone"":""mid"",""romanization"":""khue""},{""thai"":""สิ่งที่"",""english"":""the thing that"",""tone"":""low"",""romanization"":""sìng thîi""},{""thai"":""สำคัญที่สุด"",""english"":""most important"",""tone"":""rising"",""romanization"":""sǎm-khan thîi sùt""}]",medium
การให้เงินเพื่อการศึกษาเป็นสิ่งที่ดี,kaan hâi ngoen phûea kaan sèuk-sǎa bpen sìng thîi dii,Donating money for education is a good thing.,"[{""thai"":""การให้"",""english"":""Donating"",""tone"":""falling"",""romanization"":""kaan hâi"",""grammar"":true},{""thai"":""เงิน"",""english"":""money"",""tone"":""mid"",""romanization"":""ngoen""},{""thai"":""เพื่อการศึกษา"",""english"":""for education"",""tone"":""falling"",""romanization"":""phûea kaan sèuk-sǎa"",""grammar"":true},{""thai"":""เป็น"",""english"":""is"",""tone"":""mid"",""romanization"":""bpen""},{""thai"":""สิ่งที่ดี"",""english"":""a good thing"",""tone"":""falling"",""romanization"":""sìng thîi dii""}]",hard
ความสามารถในการตัดสินใจเป็นสิ่งสำคัญ,khwaam sǎa-mâat nai kaan tàt-sǐn-jai bpen sìng sǎm-khan,The ability to make decisions is important.,"[{""thai"":""ความสามารถ"",""english"":""The ability"",""tone"":""mid"",""romanization"":""khwaam sǎa-mâat"",""grammar"":true},{""thai"":""ในการตัดสินใจ"",""english"":""to make decisions"",""tone"":""falling"",""romanization"":""nai kaan tàt-sǐn-jai"",""grammar"":true},{""thai"":""เป็น"",""english"":""is"",""tone"":""mid"",""romanization"":""bpen""},{""thai"":""สิ่งสำคัญ"",""english"":""important"",""tone"":""rising"",""romanization"":""sìng sǎm-khan""}]",medium
การทำงานเป็นทีมมีความสำคัญมาก,kaan tham-ngaan bpen thiim mii khwaam sǎm-khan mâak,Teamwork is very important.,"[{""thai"":""การทำงาน"",""english"":""Teamwork"",""tone"":""mid"",""romanization"":""kaan tham-ngaan"",""grammar"":true},{""thai"":""เป็นทีม"",""english"":""as a team"",""tone"":""mid"",""romanization"":""bpen thiim""},{""thai"":""มีความสำคัญ"",""english"":""is important"",""tone"":""rising"",""romanization"":""mii khwaam sǎm-khan"",""grammar"":true},{""thai"":""มาก"",""english"":""very"",""tone"":""falling"",""romanization"":""mâak""}]",easy
ความคิดสร้างสรรค์ช่วยในการแก้ปัญหา,khwaam khít sáang-sǎn chûai nai kaan gâe pan-hǎa,Creativity helps in problem solving.,"[{""thai"":""ความคิดสร้างสรรค์"",""english"":""Creativity"",""tone"":""mid"",""romanization"":""khwaam khít sáang-sǎn"",""grammar"":true},{""thai"":""ช่วย"",""english"":""helps"",""tone"":""falling"",""romanization"":""chûai""},{""thai"":""ในการแก้ปัญหา"",""english"":""in problem solving"",""tone"":""falling"",""romanization"":""nai kaan gâe pan-hǎa"",""grammar"":true}]",medium
การใช้เวลาอย่างมีประสิทธิภาพทำให้ชีวิตดีขึ้น,kaan chái welaa yàang mii prà-sìt-thì-phâap tham hâi chii-wít dii khûen,Using time efficiently improves life.,"[{""thai"":""การใช้เวลา"",""english"":""Using time"",""tone"":""high"",""romanization"":""kaan chái welaa"",""grammar"":true},{""thai"":""อย่างมีประสิทธิภาพ"",""english"":""efficiently"",""tone"":""low"",""romanization"":""yàang mii prà-sìt-thì-phâap""},{""thai"":""ทำให้"",""english"":""improves"",""tone"":""falling"",""romanization"":""tham hâi""},{""thai"":""ชีวิต"",""english"":""life"",""tone"":""rising"",""romanization"":""chii-wít""},{""thai"":""ดีขึ้น"",""english"":""better"",""tone"":""falling"",""romanization"":""dii khûen""}]",hard
ความสำเร็จมาจากการทำงานอย่างหนัก,khwaam sǎm-rèt maa jàak kaan tham-ngaan yàang nàk,Success comes from working hard.,"[{""thai"":""ความสำเร็จ"",""english"":""Success"",""tone"":""rising"",""romanization"":""khwaam sǎm-rèt"",""grammar"":true},{""thai"":""มาจาก"",""english"":""comes from"",""tone"":""mid"",""romanization"":""maa jàak""},{""thai"":""การทำงาน"",""english"":""working"",""tone"":""mid"",""romanization"":""kaan tham-ngaan"",""grammar"":true},{""thai"":""อย่างหนัก"",""english"":""hard"",""tone"":""low"",""romanization"":""yàang nàk""}]",medium
การพักผ่อนอย่างเพียงพอช่วยทำให้ไม่เครียด,kaan phák-phòn yàang phiang-phoo chûai tham hâi mâi khrîet,Getting enough rest helps reduce stress.,"[{""thai"":""การพักผ่อน"",""english"":""Getting rest"",""tone"":""high"",""romanization"":""kaan phák-phòn"",""grammar"":true},{""thai"":""อย่างเพียงพอ"",""english"":""enough"",""tone"":""high"",""romanization"":""yàang phiang-phoo""},{""thai"":""ช่วยทำให้"",""english"":""helps reduce"",""tone"":""falling"",""romanization"":""chûai tham hâi""},{""thai"":""ไม่เครียด"",""english"":""not stressed"",""tone"":""falling"",""romanization"":""mâi khrîet""}]",hard
ความเข้าใจในวัฒนธรรมต่างๆมีความสำคัญ,khwaam khâo-jai nai wát-tha-ná-tham tàang-tàang mii khwaam sǎm-khan,Understanding different cultures is important.,"[{""thai"":""ความเข้าใจ"",""english"":""Understanding"",""tone"":""falling"",""romanization"":""khwaam khâo-jai"",""grammar"":true},{""thai"":""ในวัฒนธรรมต่างๆ"",""english"":""different cultures"",""tone"":""falling"",""romanization"":""nai wát-tha-ná-tham tàang-tàang""},{""thai"":""มีความสำคัญ"",""english"":""is important"",""tone"":""rising"",""romanization"":""mii khwaam sǎm-khan"",""grammar"":true}]",medium
การอ่านหนังสือช่วยเพิ่มความรู้,kaan àan năng-sǔe chûai phûem khwaam rúu,Reading books increases knowledge.,"[{""thai"":""การอ่าน"",""english"":""Reading"",""tone"":""mid"",""romanization"":""kaan àan"",""grammar"":true},{""thai"":""หนังสือ"",""english"":""books"",""tone"":""rising"",""romanization"":""năng-sǔe""},{""thai"":""ช่วยเพิ่ม"",""english"":""increases"",""tone"":""falling"",""romanization"":""chûai phûem""},{""thai"":""ความรู้"",""english"":""knowledge"",""tone"":""rising"",""romanization"":""khwaam rúu"",""grammar"":true}]",easy
ความคิดที่ดีทำให้เกิดการเปลี่ยนแปลง,khwaam khít thîi dii tham hâi gèrd kaan plìan-plaaeng,Good ideas lead to change.,"[{""thai"":""ความคิดที่ดี"",""english"":""Good ideas"",""tone"":""mid"",""romanization"":""khwaam khít thîi dii"",""grammar"":true},{""thai"":""ทำให้เกิด"",""english"":""lead to"",""tone"":""falling"",""romanization"":""tham hâi gèrd""},{""thai"":""การเปลี่ยนแปลง"",""english"":""change"",""tone"":""falling"",""romanization"":""kaan plìan-plaaeng"",""grammar"":true}]",medium
การวางแผนล่วงหน้าช่วยลดความเสี่ยง,kaan waang-phǎen lûuang-nâa chûai lót khwaam sîang,Planning ahead helps reduce risk.,"[{""thai"":""การวางแผน"",""english"":""Planning"",""tone"":""mid"",""romanization"":""kaan waang-phǎen"",""grammar"":true},{""thai"":""ล่วงหน้า"",""english"":""ahead"",""tone"":""falling"",""romanization"":""lûuang-nâa""},{""thai"":""ช่วยลด"",""english"":""helps reduce"",""tone"":""falling"",""romanization"":""chûai lót""},{""thai"":""ความเสี่ยง"",""english"":""risk"",""tone"":""low"",""romanization"":""khwaam sîang"",""grammar"":true}]",hard
ความเฉื่อยชาไม่ช่วยให้เกิดการพัฒนา,khwaam chùueai-chaa mâi chûai hâi gèrd kaan phát-thá-naa,Laziness does not lead to development.,"[{""thai"":""ความเฉื่อยชา"",""english"":""Laziness"",""tone"":""low"",""romanization"":""khwaam chùueai-chaa"",""grammar"":true},{""thai"":""ไม่ช่วยให้เกิด"",""english"":""does not lead to"",""tone"":""falling"",""romanization"":""mâi chûai hâi gèrd""},{""thai"":""การพัฒนา"",""english"":""development"",""tone"":""high"",""romanization"":""kaan phát-thá-naa"",""grammar"":true}]",hard
การรับประทานอาหารเพื่อสุขภาพช่วยให้ร่างกายแข็งแรง,kaan ráp-prà-thaan aa-hǎan phûea sùk-khà-phâap chûai hâi râang-gaai khǎeng-raeng,Eating healthy food helps keep the body strong.,"[{""thai"":""การรับประทาน"",""english"":""Eating"",""tone"":""mid"",""romanization"":""kaan ráp-prà-thaan"",""grammar"":true},{""thai"":""อาหาร"",""english"":""food"",""tone"":""rising"",""romanization"":""aa-hǎan""},{""thai"":""เพื่อสุขภาพ"",""english"":""healthy"",""tone"":""falling"",""romanization"":""phûea sùk-khà-phâap""},{""thai"":""ช่วยให้"",""english"":""helps keep"",""tone"":""falling"",""romanization"":""chûai hâi""},{""thai"":""ร่างกายแข็งแรง"",""english"":""the body strong"",""tone"":""rising"",""romanization"":""râang-gaai khǎeng-raeng""}]",hard
ความปลอดภัยในการเดินทางเป็นสิ่งสำคัญ,khwaam plòot-phai nai kaan deen-thaang bpen sìng sǎm-khan,Safety in travel is important.,"[{""thai"":""ความปลอดภัย"",""english"":""Safety"",""tone"":""falling"",""romanization"":""khwaam plòot-phai"",""grammar"":true},{""thai"":""ในการเดินทาง"",""english"":""in travel"",""tone"":""falling"",""romanization"":""nai kaan deen-thaang"",""grammar"":true},{""thai"":""เป็นสิ่งสำคัญ"",""english"":""is important"",""tone"":""rising"",""romanization"":""bpen sìng sǎm-khan""}]",medium
การเรียนรู้ภาษาใหม่ๆช่วยเปิดโลกทัศน์,kaan rian-rú phaasǎa mài-mài chûai pùet lôk-thát,Learning new languages broadens perspectives.,"[{""thai"":""การเรียนรู้"",""english"":""Learning"",""tone"":""mid"",""romanization"":""kaan rian-rú"",""grammar"":true},{""thai"":""ภาษาใหม่ๆ"",""english"":""new languages"",""tone"":""rising"",""romanization"":""phaasǎa mài-mài""},{""thai"":""ช่วยเปิด"",""english"":""broadens"",""tone"":""falling"",""romanization"":""chûai pùet""},{""thai"":""โลกทัศน์"",""english"":""perspectives"",""tone"":""high"",""romanization"":""lôk-thát""}]",medium
ความยากลำบากสอนให้เราเข้มแข็ง,khwaam yâak lam-bàak sǎwn hâi rao khêm-khǎeng,Hardships teach us to be strong.,"[{""thai"":""ความยากลำบาก"",""english"":""Hardships"",""tone"":""falling"",""romanization"":""khwaam yâak lam-bàak"",""grammar"":true},{""thai"":""สอนให้"",""english"":""teach us"",""tone"":""rising"",""romanization"":""sǎwn hâi""},{""thai"":""เรา"",""english"":""us"",""tone"":""mid"",""romanization"":""rao""},{""thai"":""เข้มแข็ง"",""english"":""to be strong"",""tone"":""falling"",""romanization"":""khêm-khǎeng""}]",medium
การออกกำลังกายเป็นประจำนั้นดีต่อสุขภาพ,kaan òrk-gam-lang-gaai bpen prà-jam nân dii tò sùk-khà-phâap,Regular exercise is good for health.,"[{""thai"":""การออกกำลังกาย"",""english"":""Exercise"",""tone"":""mid"",""romanization"":""gaan òrk-gam-lang-gaai"",""grammar"":true},{""thai"":""เป็นประจำ"",""english"":""regular"",""tone"":""mid"",""romanization"":""bpen prà-jam""},{""thai"":""นั้นดีต่อ"",""english"":""is good for"",""tone"":""falling"",""romanization"":""nân dii tò""},{""thai"":""สุขภาพ"",""english"":""health"",""tone"":""low"",""romanization"":""sùk-khà-phâap""}]",easy
ความสำเร็จในการทำงานขึ้นอยู่กับความพยายาม,khwaam sǎm-rèt nai kaan tham-ngaan khûen yùu gàp khwaam phà-yaa-yaam,Success at work depends on effort.,"[{""thai"":""ความสำเร็จ"",""english"":""Success"",""tone"":""rising"",""romanization"":""khwaam sǎm-rèt"",""grammar"":true},{""thai"":""ในการทำงาน"",""english"":""at work"",""tone"":""falling"",""romanization"":""nai kaan tham-ngaan"",""grammar"":true},{""thai"":""ขึ้นอยู่กับ"",""english"":""depends on"",""tone"":""falling"",""romanization"":""khûen yùu gàp""},{""thai"":""ความพยายาม"",""english"":""effort"",""tone"":""mid"",""romanization"":""khwaam phà-yaa-yaam"",""grammar"":true}]",hard
การเตรียมตัวที่ดีช่วยให้เราพร้อมรับมือกับปัญหา,kaan dtriiam dtuua thîi dii chûai hâi rao phráwm ráp-mue gàp pan-hǎa,Good preparation helps us be ready to handle problems.,"[{""thai"":""การเตรียมตัว"",""english"":""Preparation"",""tone"":""mid"",""romanization"":""gaan dtriiam dtuua"",""grammar"":true},{""thai"":""ที่ดี"",""english"":""that is good"",""tone"":""low"",""romanization"":""thîi dii""},{""thai"":""ช่วยให้เรา"",""english"":""helps us"",""tone"":""falling"",""romanization"":""chûai hâi rao""},{""thai"":""พร้อมรับมือกับ"",""english"":""be ready to handle"",""tone"":""falling"",""romanization"":""phráwm ráp-mue gàp""},{""thai"":""ปัญหา"",""english"":""problems"",""tone"":""rising"",""romanization"":""pan-hǎa""}]",hard
ความเข้าใจผิดอาจทำให้เกิดความขัดแย้ง,khwaam khâo-jai phìt àat tham hâi gèrd khwaam khàt-yǎaeng,Misunderstanding can lead to conflict.,"[{""thai"":""ความเข้าใจผิด"",""english"":""Misunderstanding"",""tone"":""falling"",""romanization"":""khwaam khâo-jai phìt"",""grammar"":true},{""thai"":""อาจทำให้เกิด"",""english"":""can lead to"",""tone"":""falling"",""romanization"":""àat tham hâi gèrd""},{""thai"":""ความขัดแย้ง"",""english"":""conflict"",""tone"":""low"",""romanization"":""khwaam khàt-yǎaeng"",""grammar"":true}]",medium
การดูแลสุขภาพเป็นเรื่องสำคัญที่ทุกคนควรใส่ใจ,kaan duu-lae sùk-khà-phâap bpen rûeang sǎm-khan thîi thúk khon khuan sài-jai,Taking care of health is important and everyone should pay attention.,"[{""thai"":""การดูแลสุขภาพ"",""english"":""Taking care of health"",""tone"":""mid"",""romanization"":""kaan duu-lae sùk-khà-phâap"",""grammar"":true},{""thai"":""เป็นเรื่องสำคัญ"",""english"":""is important"",""tone"":""rising"",""romanization"":""bpen rûeang sǎm-khan""},{""thai"":""ที่ทุกคน"",""english"":""that everyone"",""tone"":""falling"",""romanization"":""thîi thúk khon""},{""thai"":""ควรใส่ใจ"",""english"":""should pay attention"",""tone"":""falling"",""romanization"":""khuan sài-jai""}]",hard