thai,romanization,english,breakdown,difficulty
เขาเก่งมาก ไม่ใช่หรือ,khao keng mak mai chai rue,"He's very capable, isn't he?","[{""thai"":""เขา"",""english"":""he / she"",""romanization"":""khao""},{""thai"":""เก่ง"",""english"":""capable"",""tones"":[""low""],""tone"":""low"",""romanization"":""kèng""},{""thai"":""มาก"",""english"":""very"",""tones"":[""falling""],""tone"":""falling"",""romanization"":""mâak""},{""thai"":""ไม่ใช่หรือ"",""english"":""isn't it / right?"",""tones"":[""falling"",""falling"",""rising""],""grammar"":true,""romanization"":""mâi châi rǔe""}]",hard
เขาเก่งมาก ไม่ใช่หรือ,khao keng maak mai chai rue,"He's very capable, isn't he?","[{""thai"":""เขาเก่งมาก"",""english"":""he is very capable"",""tones"":[""rising"",""falling"",""falling""],""romanization"":""khao keng maak""},{""thai"":""ไม่ใช่หรือ"",""english"":""isn't it / right?"",""tones"":[""falling"",""falling"",""rising""],""grammar"":true,""romanization"":""mai chai rue""}]",hard
วันนี้อากาศดีมาก ไม่ใช่หรือ,wan-nii aa-kaat dii maak mai chai rue,"The weather is very nice today, isn't it?","[{""thai"":""วันนี้อากาศดีมาก"",""english"":""the weather is very nice today"",""tones"":[""mid"",""high"",""mid"",""high"",""mid"",""falling""],""romanization"":""wan-nii aa-kaat dii maak""},{""thai"":""ไม่ใช่หรือ"",""english"":""isn't it / right?"",""tones"":[""falling"",""falling"",""rising""],""grammar"":true,""romanization"":""mai chai rue""}]",hard
วิธีนี้ง่ายกว่า ไม่ใช่หรือ,wi-thii nii ngaai gwaa mai chai rue,"This method is easier, isn't it?","[{""thai"":""วิธีนี้ง่ายกว่า"",""english"":""this method is easier"",""tones"":[""mid"",""falling"",""high"",""falling"",""low""],""romanization"":""wi-thii nii ngaai gwaa""},{""thai"":""ไม่ใช่หรือ"",""english"":""isn't it / right?"",""tones"":[""falling"",""falling"",""rising""],""grammar"":true,""romanization"":""mai chai rue""}]",hard
ร้านนี้เงียบดี ไม่ใช่หรือ,raan nii ngiap dii mai chai rue,"This place is nicely quiet, isn't it?","[{""thai"":""ร้านนี้เงียบดี"",""english"":""this place is nicely quiet"",""tones"":[""high"",""high"",""low"",""mid""],""romanization"":""raan nii ngiap dii""},{""thai"":""ไม่ใช่หรือ"",""english"":""isn't it / right?"",""tones"":[""falling"",""falling"",""rising""],""grammar"":true,""romanization"":""mai chai rue""}]",hard
คุณเคยเห็นที่นี่แล้ว ไม่ใช่หรือ,khun koey hen thii nii laeo mai chai rue,"You've seen this place before, haven't you?","[{""thai"":""คุณเคยเห็นที่นี่แล้ว"",""english"":""you've seen this place before"",""tones"":[""mid"",""mid"",""rising"",""falling"",""high"",""high""],""romanization"":""khun koey hen thii nii laeo""},{""thai"":""ไม่ใช่หรือ"",""english"":""isn't it / right?"",""tones"":[""falling"",""falling"",""rising""],""grammar"":true,""romanization"":""mai chai rue""}]",hard
เราคุยเรื่องนี้กันแล้ว ไม่ใช่หรือ,rao khui rueang nii gan laeo mai chai rue,"We've already talked about this, haven't we?","[{""thai"":""เราคุยเรื่องนี้กันแล้ว"",""english"":""we've already talked about this"",""tones"":[""mid"",""mid"",""falling"",""high"",""mid"",""high""],""romanization"":""rao khui rueang nii gan laeo""},{""thai"":""ไม่ใช่หรือ"",""english"":""isn't it / right?"",""tones"":[""falling"",""falling"",""rising""],""grammar"":true,""romanization"":""mai chai rue""}]",hard
ข้อนี้ชัดเจนมาก ไม่ใช่หรือ,khaw nii chat-jen maak mai chai rue,"This point is very clear, isn't it?","[{""thai"":""ข้อนี้ชัดเจนมาก"",""english"":""this point is very clear"",""tones"":[""falling"",""high"",""low"",""mid"",""falling""],""romanization"":""khaw nii chat-jen maak""},{""thai"":""ไม่ใช่หรือ"",""english"":""isn't it / right?"",""tones"":[""falling"",""falling"",""rising""],""grammar"":true,""romanization"":""mai chai rue""}]",hard
ทีมนี้พร้อมแล้ว ไม่ใช่หรือ,thiim nii phrawm laeo mai chai rue,"This team is ready already, isn't it?","[{""thai"":""ทีมนี้พร้อมแล้ว"",""english"":""this team is ready already"",""tones"":[""mid"",""high"",""falling"",""high""],""romanization"":""thiim nii phrawm laeo""},{""thai"":""ไม่ใช่หรือ"",""english"":""isn't it / right?"",""tones"":[""falling"",""falling"",""rising""],""grammar"":true,""romanization"":""mai chai rue""}]",hard
เขาตอบชัดมาก ไม่ใช่หรือ,khao dtop chat maak mai chai rue,"He answered very clearly, didn't he?","[{""thai"":""เขาตอบชัดมาก"",""english"":""he answered very clearly"",""tones"":[""rising"",""low"",""low"",""falling""],""romanization"":""khao dtop chat maak""},{""thai"":""ไม่ใช่หรือ"",""english"":""isn't it / right?"",""tones"":[""falling"",""falling"",""rising""],""grammar"":true,""romanization"":""mai chai rue""}]",hard
แบบนี้สะดวกกว่า ไม่ใช่หรือ,baep nii sa-duak gwaa mai chai rue,"This is more convenient, isn't it?","[{""thai"":""แบบนี้สะดวกกว่า"",""english"":""this is more convenient"",""tones"":[""low"",""high"",""low"",""low"",""low""],""romanization"":""baep nii sa-duak gwaa""},{""thai"":""ไม่ใช่หรือ"",""english"":""isn't it / right?"",""tones"":[""falling"",""falling"",""rising""],""grammar"":true,""romanization"":""mai chai rue""}]",hard
คุณก็เห็นเหมือนกัน ไม่ใช่หรือ,khun gor hen muean-gan mai chai rue,"You see it the same way too, don't you?","[{""thai"":""คุณก็เห็นเหมือนกัน"",""english"":""you see it the same way"",""tones"":[""mid"",""falling"",""rising"",""falling"",""mid""],""romanization"":""khun gor hen muean-gan""},{""thai"":""ไม่ใช่หรือ"",""english"":""isn't it / right?"",""tones"":[""falling"",""falling"",""rising""],""grammar"":true,""romanization"":""mai chai rue""}]",hard
นี่คือสิ่งที่เราต้องแก้ ไม่ใช่หรือ,nii khue sing thii rao dtong gae mai chai rue,"This is what we need to fix, isn't it?","[{""thai"":""นี่คือสิ่งที่เราต้องแก้"",""english"":""this is what we need to fix"",""tones"":[""high"",""mid"",""falling"",""falling"",""mid"",""falling"",""falling""],""romanization"":""nii khue sing thii rao dtong gae""},{""thai"":""ไม่ใช่หรือ"",""english"":""isn't it / right?"",""tones"":[""falling"",""falling"",""rising""],""grammar"":true,""romanization"":""mai chai rue""}]",hard
ปัญหาหลักอยู่ตรงนี้ ไม่ใช่หรือ,bpan-haa lak yuu dtrong nii mai chai rue,"This is where the main problem is, isn't it?","[{""thai"":""ปัญหาหลักอยู่ตรงนี้"",""english"":""this is where the main problem is"",""tones"":[""mid"",""high"",""high"",""low"",""mid"",""high""],""romanization"":""bpan-haa lak yuu dtrong nii""},{""thai"":""ไม่ใช่หรือ"",""english"":""isn't it / right?"",""tones"":[""falling"",""falling"",""rising""],""grammar"":true,""romanization"":""mai chai rue""}]",hard
เราควรเริ่มตอนนี้ ไม่ใช่หรือ,rao khuan reum dtawn-nii mai chai rue,"We should start now, shouldn't we?","[{""thai"":""เราควรเริ่มตอนนี้"",""english"":""we should start now"",""tones"":[""mid"",""rising"",""mid"",""mid"",""high""],""romanization"":""rao khuan reum dtawn-nii""},{""thai"":""ไม่ใช่หรือ"",""english"":""isn't it / right?"",""tones"":[""falling"",""falling"",""rising""],""grammar"":true,""romanization"":""mai chai rue""}]",hard
เขาเป็นคนที่เหมาะที่สุด ไม่ใช่หรือ,khao bpen khon thii moh thii-sut mai chai rue,"He is the most suitable person, isn't he?","[{""thai"":""เขาเป็นคนที่เหมาะที่สุด"",""english"":""he is the most suitable person"",""tones"":[""rising"",""mid"",""mid"",""falling"",""falling"",""mid"",""low""],""romanization"":""khao bpen khon thii moh thii-sut""},{""thai"":""ไม่ใช่หรือ"",""english"":""isn't it / right?"",""tones"":[""falling"",""falling"",""rising""],""grammar"":true,""romanization"":""mai chai rue""}]",hard
เรื่องนี้สำคัญมาก ไม่ใช่หรือ,rueang nii sam-khan maak mai chai rue,"This matter is very important, isn't it?","[{""thai"":""เรื่องนี้สำคัญมาก"",""english"":""this matter is very important"",""tones"":[""falling"",""high"",""mid"",""falling"",""falling""],""romanization"":""rueang nii sam-khan maak""},{""thai"":""ไม่ใช่หรือ"",""english"":""isn't it / right?"",""tones"":[""falling"",""falling"",""rising""],""grammar"":true,""romanization"":""mai chai rue""}]",hard
เธอก็รู้ดี ไม่ใช่หรือ,thoe gor ruu dii mai chai rue,"You know that well, don't you?","[{""thai"":""เธอก็รู้ดี"",""english"":""you know that well"",""tones"":[""mid"",""falling"",""high"",""mid""],""romanization"":""thoe gor ruu dii""},{""thai"":""ไม่ใช่หรือ"",""english"":""isn't it / right?"",""tones"":[""falling"",""falling"",""rising""],""grammar"":true,""romanization"":""mai chai rue""}]",hard
ทางนี้ใกล้กว่า ไม่ใช่หรือ,thaang nii glai gwaa mai chai rue,"This way is closer, isn't it?","[{""thai"":""ทางนี้ใกล้กว่า"",""english"":""this way is closer"",""tones"":[""mid"",""high"",""falling"",""low""],""romanization"":""thaang nii glai gwaa""},{""thai"":""ไม่ใช่หรือ"",""english"":""isn't it / right?"",""tones"":[""falling"",""falling"",""rising""],""grammar"":true,""romanization"":""mai chai rue""}]",hard
เราตกลงกันแล้ว ไม่ใช่หรือ,rao dtok-long gan laeo mai chai rue,"We already agreed on it, didn't we?","[{""thai"":""เราตกลงกันแล้ว"",""english"":""we already agreed on it"",""tones"":[""mid"",""low"",""mid"",""mid"",""high""],""romanization"":""rao dtok-long gan laeo""},{""thai"":""ไม่ใช่หรือ"",""english"":""isn't it / right?"",""tones"":[""falling"",""falling"",""rising""],""grammar"":true,""romanization"":""mai chai rue""}]",hard
ประเด็นนี้เกี่ยวกับลูกค้า ไม่ใช่หรือ,bpra-den nii kiaw-gap luuk-khaa mai chai rue,"This point is about the client, isn't it?","[{""thai"":""ประเด็นนี้เกี่ยวกับลูกค้า"",""english"":""this point is about the client"",""tones"":[""mid"",""mid"",""high"",""low"",""falling"",""high""],""romanization"":""bpra-den nii kiaw-gap luuk-khaa""},{""thai"":""ไม่ใช่หรือ"",""english"":""isn't it / right?"",""tones"":[""falling"",""falling"",""rising""],""grammar"":true,""romanization"":""mai chai rue""}]",hard
เขาน่าจะถึงแล้ว ไม่ใช่หรือ,khao naa-ja theung laeo mai chai rue,"He should have arrived already, shouldn't he?","[{""thai"":""เขาน่าจะถึงแล้ว"",""english"":""he should have arrived already"",""tones"":[""rising"",""falling"",""low"",""rising"",""high""],""romanization"":""khao naa-ja theung laeo""},{""thai"":""ไม่ใช่หรือ"",""english"":""isn't it / right?"",""tones"":[""falling"",""falling"",""rising""],""grammar"":true,""romanization"":""mai chai rue""}]",hard
แบบนี้ปลอดภัยกว่า ไม่ใช่หรือ,baep nii bplawt-phai gwaa mai chai rue,"This is safer, isn't it?","[{""thai"":""แบบนี้ปลอดภัยกว่า"",""english"":""this is safer"",""tones"":[""low"",""high"",""low"",""high"",""low""],""romanization"":""baep nii bplawt-phai gwaa""},{""thai"":""ไม่ใช่หรือ"",""english"":""isn't it / right?"",""tones"":[""falling"",""falling"",""rising""],""grammar"":true,""romanization"":""mai chai rue""}]",hard
คุณต้องการคำอธิบายเพิ่ม ไม่ใช่หรือ,khun dtong-gaan kham a-thi-baai pherme mai chai rue,"You want more explanation, don't you?","[{""thai"":""คุณต้องการคำอธิบายเพิ่ม"",""english"":""you want more explanation"",""tones"":[""mid"",""falling"",""mid"",""mid"",""low"",""high"",""falling""],""romanization"":""khun dtong-gaan kham a-thi-baai pherme""},{""thai"":""ไม่ใช่หรือ"",""english"":""isn't it / right?"",""tones"":[""falling"",""falling"",""rising""],""grammar"":true,""romanization"":""mai chai rue""}]",hard
นี่เป็นโอกาสดี ไม่ใช่หรือ,nii bpen oo-gaat dii mai chai rue,"This is a good opportunity, isn't it?","[{""thai"":""นี่เป็นโอกาสดี"",""english"":""this is a good opportunity"",""tones"":[""high"",""mid"",""mid"",""low"",""mid""],""romanization"":""nii bpen oo-gaat dii""},{""thai"":""ไม่ใช่หรือ"",""english"":""isn't it / right?"",""tones"":[""falling"",""falling"",""rising""],""grammar"":true,""romanization"":""mai chai rue""}]",hard
เขาพูดตรงไปหน่อย ไม่ใช่หรือ,khao phuut dtrong bpai noi mai chai rue,"He was a little too direct, wasn't he?","[{""thai"":""เขาพูดตรงไปหน่อย"",""english"":""he was a little too direct"",""tones"":[""rising"",""falling"",""mid"",""mid"",""low""],""romanization"":""khao phuut dtrong bpai noi""},{""thai"":""ไม่ใช่หรือ"",""english"":""isn't it / right?"",""tones"":[""falling"",""falling"",""rising""],""grammar"":true,""romanization"":""mai chai rue""}]",hard