thai,romanization,english,breakdown,difficulty
เราซื้อของ จากนั้นกลับบ้าน,rao sue khong chak nan klap ban,"We bought things. After that, we went home.","[{""thai"":""เรา"",""english"":""we"",""romanization"":""rao""},{""thai"":""ซื้อ"",""english"":""buy"",""tones"":[""high""],""tone"":""high"",""romanization"":""sue""},{""thai"":""ของ"",""english"":""things"",""romanization"":""khong""},{""thai"":""จากนั้น"",""english"":""after that"",""grammar"":true,""romanization"":""chak nan""},{""thai"":""กลับบ้าน"",""english"":""go home"",""romanization"":""klap ban""}]",easy
เขาเรียนเสร็จ จากนั้นโทรหาแม่,khao rian set chak nan thoh ha mae,"He finished studying. After that, he called Mom.","[{""thai"":""เขา"",""english"":""he / she"",""romanization"":""khao""},{""thai"":""เรียน"",""english"":""study"",""romanization"":""rian""},{""thai"":""เสร็จ"",""english"":""finish"",""grammar"":true,""romanization"":""set""},{""thai"":""จากนั้น"",""english"":""after that"",""grammar"":true,""romanization"":""chak nan""},{""thai"":""โทรหา"",""english"":""call"",""romanization"":""thoh ha""},{""thai"":""แม่"",""english"":""mom"",""tones"":[""falling""],""tone"":""falling"",""romanization"":""mae""}]",easy
เขาทำงานเสร็จ จากนั้นไปออกกำลังกาย,"khǎo tham-ngaan sèt, jàak nán pai òk kamlang-gaai","He finished work, and after that went to exercise.","[{""thai"":""เขา"",""english"":""he"",""romanization"":""khao""},{""thai"":""ทำงาน"",""english"":""work"",""romanization"":""tham-ngaan""},{""thai"":""เสร็จ"",""english"":""finish"",""romanization"":""set""},{""thai"":""จากนั้น"",""english"":""after that"",""grammar"":true,""romanization"":""jaak nan""},{""thai"":""ไป"",""english"":""go"",""tones"":[""mid""],""tone"":""mid"",""romanization"":""pai""},{""thai"":""ออกกำลังกาย"",""english"":""exercise"",""romanization"":""ok kamlang-gaai""}]",easy
เราทานข้าวเสร็จ จากนั้นก็ดูทีวี,"rao than khâao sèt, jàak nán gôo duu thiiwii","We finished eating, and after that watched TV.","[{""thai"":""เรา"",""english"":""we"",""romanization"":""rao""},{""thai"":""ทานข้าว"",""english"":""eat"",""romanization"":""than khâao""},{""thai"":""เสร็จ"",""english"":""finish"",""tones"":[""low""],""tone"":""low"",""romanization"":""sèt""},{""thai"":""จากนั้น"",""english"":""after that"",""tones"":[""low"",""high""],""grammar"":true,""romanization"":""jàak nán""},{""thai"":""ก็ดู"",""english"":""watched"",""romanization"":""gôo duu""},{""thai"":""ทีวี"",""english"":""TV"",""romanization"":""thiiwii""}]",easy
พวกเขาดูหนัง จากนั้นก็ไปดื่มกาแฟ,"phûak khǎo duu nǎng, jàak nán gôo pai dûem gaafae","They watched a movie, and after that went to have coffee.","[{""thai"":""พวกเขา"",""english"":""they"",""tones"":[""falling"",""rising""],""romanization"":""phûak khǎo""},{""thai"":""ดูหนัง"",""english"":""watched a movie"",""romanization"":""duu nǎng""},{""thai"":""จากนั้น"",""english"":""after that"",""tones"":[""low"",""high""],""grammar"":true,""romanization"":""jàak nán""},{""thai"":""ก็ไป"",""english"":""went"",""romanization"":""gôo pai""},{""thai"":""ดื่ม"",""english"":""to have"",""tones"":[""low""],""tone"":""low"",""romanization"":""dûem""},{""thai"":""กาแฟ"",""english"":""coffee"",""romanization"":""gaafae""}]",medium
เขาทำอาหาร จากนั้นเก็บครัว,"khǎo tham aahǎan, jàak nán kèb khrua","He cooked, and after that cleaned the kitchen.","[{""thai"":""เขา"",""english"":""he"",""romanization"":""khao""},{""thai"":""ทำอาหาร"",""english"":""cooked"",""romanization"":""tham aahǎan""},{""thai"":""จากนั้น"",""english"":""after that"",""tones"":[""low"",""high""],""grammar"":true,""romanization"":""jàak nán""},{""thai"":""เก็บครัว"",""english"":""cleaned the kitchen"",""romanization"":""kèb khrua""}]",medium
ฉันฟังเพลง จากนั้นก็อาบน้ำ,"chǎn fang phleeng, jàak nán gôo àap náam","I listened to music, and after that took a shower.","[{""thai"":""ฉัน"",""english"":""I"",""tones"":[""rising""],""tone"":""rising"",""romanization"":""chǎn""},{""thai"":""ฟังเพลง"",""english"":""listened to music"",""romanization"":""fang phleeng""},{""thai"":""จากนั้น"",""english"":""after that"",""tones"":[""low"",""high""],""grammar"":true,""romanization"":""jàak nán""},{""thai"":""ก็อาบ"",""english"":""took"",""tones"":[""falling"",""low""],""romanization"":""gôo àap""},{""thai"":""น้ำ"",""english"":""shower"",""tones"":[""high""],""tone"":""high"",""romanization"":""náam""}]",medium
นักเรียนเข้าชั้นเรียน จากนั้นก็ทำกิจกรรม,"nákrain khâo chán rian, jàak nán gôo tham kìtchakam","The students entered the classroom, and after that did activities.","[{""thai"":""นักเรียน"",""english"":""students"",""tones"":[""high""],""tone"":""high"",""romanization"":""nákrain""},{""thai"":""เข้า"",""english"":""entered"",""tones"":[""falling""],""tone"":""falling"",""romanization"":""khâo""},{""thai"":""ชั้นเรียน"",""english"":""classroom"",""romanization"":""chán rian""},{""thai"":""จากนั้น"",""english"":""after that"",""tones"":[""low"",""high""],""grammar"":true,""romanization"":""jàak nán""},{""thai"":""ก็ทำ"",""english"":""did"",""romanization"":""gôo tham""},{""thai"":""กิจกรรม"",""english"":""activities"",""tones"":[""low""],""tone"":""low"",""romanization"":""kìtchakam""}]",medium
เขาไปวิ่ง จากนั้นก็กลับบ้าน,"khǎo pai wîng, jàak nán gôo klàp bâan","He went for a run, and after that went home.","[{""thai"":""เขา"",""english"":""he"",""romanization"":""khao""},{""thai"":""ไปวิ่ง"",""english"":""went for a run"",""romanization"":""pai wîng""},{""thai"":""จากนั้น"",""english"":""after that"",""tones"":[""low"",""high""],""grammar"":true,""romanization"":""jàak nán""},{""thai"":""ก็กลับบ้าน"",""english"":""went home"",""tones"":[""falling"",""low"",""falling""],""romanization"":""gôo klàp bâan""}]",easy
เพื่อนเจอกันที่ร้านกาแฟ จากนั้นก็ไปเดินเล่น,"phûan jooe kan thîi ráan gaafae, jàak nán gôo pai dooen lên","Friends met at the coffee shop, and after that went for a walk.","[{""thai"":""เพื่อน"",""english"":""friends"",""tones"":[""falling""],""tone"":""falling"",""romanization"":""phûan""},{""thai"":""เจอกัน"",""english"":""met"",""romanization"":""jooe kan""},{""thai"":""ที่ร้านกาแฟ"",""english"":""at the coffee shop"",""romanization"":""thîi ráan gaafae""},{""thai"":""จากนั้น"",""english"":""after that"",""tones"":[""low"",""high""],""grammar"":true,""romanization"":""jàak nán""},{""thai"":""ก็ไปเดินเล่น"",""english"":""went for a walk"",""romanization"":""gôo pai dooen lên""}]",medium
พวกเขาประชุมเสร็จ จากนั้นก็ทานข้าวเที่ยงกัน,"phûak khǎo prachum sèt, jàak nán gôo thaan khâao thîang kan","They finished a meeting, and after that had lunch together.","[{""thai"":""พวกเขา"",""english"":""they"",""tones"":[""falling"",""rising""],""romanization"":""phûak khǎo""},{""thai"":""ประชุมเสร็จ"",""english"":""finished a meeting"",""romanization"":""prachum sèt""},{""thai"":""จากนั้น"",""english"":""after that"",""tones"":[""low"",""high""],""grammar"":true,""romanization"":""jàak nán""},{""thai"":""ก็ทานข้าวเที่ยงกัน"",""english"":""had lunch together"",""romanization"":""gôo thaan khâao thîang kan""}]",medium
เขาอ่านข่าว จากนั้นก็เขียนรายงาน,"khǎo àan khàaw, jàak nán gôo khǐan raai-ngaan","He read the news, and after that wrote the report.","[{""thai"":""เขา"",""english"":""he"",""romanization"":""khao""},{""thai"":""อ่านข่าว"",""english"":""read the news"",""tones"":[""low"",""low""],""romanization"":""àan khàaw""},{""thai"":""จากนั้น"",""english"":""after that"",""tones"":[""low"",""high""],""grammar"":true,""romanization"":""jàak nán""},{""thai"":""ก็เขียนรายงาน"",""english"":""wrote the report"",""romanization"":""gôo khǐan raai-ngaan""}]",medium
นักเรียนทำการบ้านเสร็จ จากนั้นก็เล่นเกม,"nákrain tham gaan-bâan sèt, jàak nán gôo lên geem","The student finished homework, and after that played games.","[{""thai"":""นักเรียน"",""english"":""student"",""tones"":[""high""],""tone"":""high"",""romanization"":""nákrain""},{""thai"":""ทำการบ้านเสร็จ"",""english"":""finished homework"",""romanization"":""tham gaan-bâan sèt""},{""thai"":""จากนั้น"",""english"":""after that"",""tones"":[""low"",""high""],""grammar"":true,""romanization"":""jàak nán""},{""thai"":""ก็เล่นเกม"",""english"":""played games"",""romanization"":""gôo lên geem""}]",medium
แม่ทำกับข้าว จากนั้นก็ขอให้ฉันล้างจาน,"mâe tham kap khâao, jàak nán gôo khǒo hâi chǎn láang jaan","Mom cooked, and after that asked me to wash the dishes.","[{""thai"":""แม่"",""english"":""mom"",""tones"":[""falling""],""tone"":""falling"",""romanization"":""mâe""},{""thai"":""ทำกับข้าว"",""english"":""cooked"",""romanization"":""tham kap khâao""},{""thai"":""จากนั้น"",""english"":""after that"",""tones"":[""low"",""high""],""grammar"":true,""romanization"":""jàak nán""},{""thai"":""ก็ขอให้"",""english"":""asked me"",""tones"":[""falling"",""rising"",""falling""],""romanization"":""gôo khǒo hâi""},{""thai"":""ฉัน"",""english"":""me"",""tones"":[""rising""],""tone"":""rising"",""romanization"":""chǎn""},{""thai"":""ล้างจาน"",""english"":""to wash the dishes"",""romanization"":""láang jaan""}]",hard
พวกเราถ่ายรูป จากนั้นก็ไปทานข้าวเย็น,"phûak rao thàai rûup, jàak nán gôo pai thaan khâao yen","We took photos, and after that went to have dinner.","[{""thai"":""พวกเรา"",""english"":""we"",""romanization"":""phûak rao""},{""thai"":""ถ่ายรูป"",""english"":""took photos"",""tones"":[""low"",""falling""],""romanization"":""thàai rûup""},{""thai"":""จากนั้น"",""english"":""after that"",""tones"":[""low"",""high""],""grammar"":true,""romanization"":""jàak nán""},{""thai"":""ก็ไปทานข้าวเย็น"",""english"":""went to have dinner"",""romanization"":""gôo pai thaan khâao yen""}]",medium
เธอทำโปรเจค จากนั้นก็ส่งอาจารย์,"thoe tham projèk, jàak nán gôo sòng ajaan","She completed the project, and after that submitted it to the professor.","[{""thai"":""เธอ"",""english"":""she"",""tones"":[""mid""],""tone"":""mid"",""romanization"":""thoe""},{""thai"":""ทำโปรเจค"",""english"":""completed the project"",""romanization"":""tham projèk""},{""thai"":""จากนั้น"",""english"":""after that"",""tones"":[""low"",""high""],""grammar"":true,""romanization"":""jàak nán""},{""thai"":""ก็ส่ง"",""english"":""submitted"",""tones"":[""falling"",""low""],""romanization"":""gôo sòng""},{""thai"":""อาจารย์"",""english"":""to the professor"",""romanization"":""ajaan""}]",hard
ฉันอาบน้ำเสร็จ จากนั้นก็แต่งตัว,"chǎn àap náam sèt, jàak nán gôo tàeng dtua","I took a shower, and after that got dressed.","[{""thai"":""ฉัน"",""english"":""I"",""tones"":[""rising""],""tone"":""rising"",""romanization"":""chǎn""},{""thai"":""อาบน้ำเสร็จ"",""english"":""took a shower"",""tones"":[""low"",""high"",""low""],""romanization"":""àap náam sèt""},{""thai"":""จากนั้น"",""english"":""after that"",""tones"":[""low"",""high""],""grammar"":true,""romanization"":""jàak nán""},{""thai"":""ก็แต่งตัว"",""english"":""got dressed"",""romanization"":""gôo tàeng dtua""}]",easy
ฉันออกจากบ้าน จากนั้นไปตลาด,"chǎn òk jàak bâan, jàak nán pai tàlàat","I left the house, and after that went to the market.","[{""thai"":""ฉัน"",""english"":""I"",""tones"":[""rising""],""tone"":""rising"",""romanization"":""chǎn""},{""thai"":""ออกจากบ้าน"",""english"":""left the house"",""tones"":[""low"",""low"",""falling""],""romanization"":""òk jàak bâan""},{""thai"":""จากนั้น"",""english"":""after that"",""tones"":[""low"",""high""],""grammar"":true,""romanization"":""jàak nán""},{""thai"":""ไปตลาด"",""english"":""went to the market"",""romanization"":""pai tàlàat""}]",easy
เขาเช็คอีเมล จากนั้นก็เริ่มทำงาน,"khǎo chék iimeel, jàak nán gôo rêem tham-ngaan","He checked his email, and after that started working.","[{""thai"":""เขา"",""english"":""He"",""romanization"":""khao""},{""thai"":""เช็คอีเมล"",""english"":""checked his email"",""romanization"":""chék iimeel""},{""thai"":""จากนั้น"",""english"":""after that"",""tones"":[""low"",""high""],""grammar"":true,""romanization"":""jàak nán""},{""thai"":""ก็เริ่มทำงาน"",""english"":""started working"",""romanization"":""gôo rêem tham-ngaan""}]",medium
เธอซักผ้า จากนั้นก็รีดผ้า,"thooe sák phâa, jàak nán gôo rîit phâa","She washed clothes, and after that ironed them.","[{""thai"":""เธอ"",""english"":""She"",""tones"":[""mid""],""tone"":""mid"",""romanization"":""thoe""},{""thai"":""ซักผ้า"",""english"":""washed clothes"",""tones"":[""high"",""falling""],""romanization"":""sák phâa""},{""thai"":""จากนั้น"",""english"":""after that"",""tones"":[""low"",""high""],""grammar"":true,""romanization"":""jàak nán""},{""thai"":""ก็รีดผ้า"",""english"":""ironed them"",""tones"":[""falling"",""falling"",""falling""],""romanization"":""gôo rîit phâa""}]",easy
เราทำรายงานเสร็จ จากนั้นก็ไปเล่นกีฬา,"rao tham raai-ngaan sèt, jàak nán gôo pai lên giilaa","We finished the report, and after that went to play sports.","[{""thai"":""เรา"",""english"":""We"",""romanization"":""rao""},{""thai"":""ทำรายงานเสร็จ"",""english"":""finished the report"",""romanization"":""tham raai-ngaan sèt""},{""thai"":""จากนั้น"",""english"":""after that"",""tones"":[""low"",""high""],""grammar"":true,""romanization"":""jàak nán""},{""thai"":""ก็ไปเล่นกีฬา"",""english"":""went to play sports"",""romanization"":""gôo pai lên giilaa""}]",medium
เขานัดเจอเพื่อน จากนั้นก็ไปทานข้าวเย็น,"khǎo nát jooe phûean, jàak nán gôo pai thaan khâao yen","He arranged to meet friends, and after that went for dinner.","[{""thai"":""เขา"",""english"":""He"",""tones"":[""rising""],""tone"":""rising"",""romanization"":""khǎo""},{""thai"":""นัดเจอเพื่อน"",""english"":""arranged to meet friends"",""romanization"":""nát jooe phûean""},{""thai"":""จากนั้น"",""english"":""after that"",""tones"":[""low"",""high""],""grammar"":true,""romanization"":""jàak nán""},{""thai"":""ก็ไปทานข้าวเย็น"",""english"":""went for dinner"",""romanization"":""gôo pai thaan khâao yen""}]",medium
นักเรียนอ่านหนังสือ จากนั้นทำแบบฝึกหัด,"nákriaan àan nǎngsǔe, jàak nán tham bàep fùek hàt","The student read the book, and after that did the exercises.","[{""thai"":""นักเรียน"",""english"":""The student"",""tones"":[""high""],""tone"":""high"",""romanization"":""nákriaan""},{""thai"":""อ่านหนังสือ"",""english"":""read the book"",""tones"":[""low"",""rising""],""romanization"":""àan nǎngsǔe""},{""thai"":""จากนั้น"",""english"":""after that"",""tones"":[""low"",""high""],""grammar"":true,""romanization"":""jàak nán""},{""thai"":""ทำแบบฝึกหัด"",""english"":""did the exercises"",""romanization"":""tham bàep fùek hàt""}]",hard
พวกเขาทำความสะอาดบ้าน จากนั้นนั่งพัก,"phûak khǎo tham khwaam sà-àat bâan, jàak nán nâng phák","They cleaned the house, and after that took a rest.","[{""thai"":""พวกเขา"",""english"":""They"",""tones"":[""falling"",""rising""],""romanization"":""phûak khǎo""},{""thai"":""ทำความสะอาดบ้าน"",""english"":""cleaned the house"",""romanization"":""tham khwaam sà-àat bâan""},{""thai"":""จากนั้น"",""english"":""after that"",""tones"":[""low"",""high""],""grammar"":true,""romanization"":""jàak nán""},{""thai"":""นั่งพัก"",""english"":""took a rest"",""tones"":[""falling"",""high""],""romanization"":""nâng phák""}]",hard
เธอประชุมเสร็จ จากนั้นส่งอีเมลให้ลูกค้า,"thooe pràchum sèt, jàak nán sòng iimeel hâi lûukkháa","She finished the meeting, and after that sent an email to the client.","[{""thai"":""เธอ"",""english"":""She"",""tones"":[""mid""],""tone"":""mid"",""romanization"":""thooe""},{""thai"":""ประชุมเสร็จ"",""english"":""finished the meeting"",""tones"":[""low"",""low""],""romanization"":""pràchum sèt""},{""thai"":""จากนั้น"",""english"":""after that"",""tones"":[""low"",""high""],""grammar"":true,""romanization"":""jàak nán""},{""thai"":""ส่งอีเมลให้ลูกค้า"",""english"":""sent an email to the client"",""romanization"":""sòng iimeel hâi lûukkháa""}]",hard