thai,romanization,english,breakdown,difficulty
เขามักจะตื่นสายในวันหยุด,khao mák jà tǔen sǎai nai wan yùt,He tends to wake up late on holidays.,"[{""thai"":""เขา"",""english"":""he"",""tone"":""rising""},{""thai"":""มักจะ"",""english"":""tends to"",""tone"":""falling"",""grammar"":true},{""thai"":""ตื่นสาย"",""english"":""wake up late"",""tone"":""rising""},{""thai"":""ในวันหยุด"",""english"":""on holidays"",""tone"":""mid""}]",easy
เธอมักจะไปวิ่งที่สวนสาธารณะตอนเช้า,thoe mák jà pai wîng thîi sǔan sǎa-thaa-ra-naa tawn cháo,She tends to go running in the park in the morning.,"[{""thai"":""เธอ"",""english"":""she"",""tone"":""mid""},{""thai"":""มักจะ"",""english"":""tends to"",""tone"":""falling"",""grammar"":true},{""thai"":""ไปวิ่ง"",""english"":""go running"",""tone"":""falling""},{""thai"":""ที่สวนสาธารณะ"",""english"":""in the park"",""tone"":""falling""},{""thai"":""ตอนเช้า"",""english"":""in the morning"",""tone"":""high""}]",medium
พวกเขามักจะทำงานล่วงเวลาวันศุกร์,phûak khao mák jà tham ngaan lûang we-laa wan sùk,They tend to work overtime on Fridays.,"[{""thai"":""พวกเขา"",""english"":""they"",""tone"":""falling""},{""thai"":""มักจะ"",""english"":""tends to"",""tone"":""falling"",""grammar"":true},{""thai"":""ทำงานล่วงเวลา"",""english"":""work overtime"",""tone"":""falling""},{""thai"":""วันศุกร์"",""english"":""on Fridays"",""tone"":""low""}]",medium
เพื่อนของฉันมักจะลืมโทรศัพท์ไว้ที่บ้าน,phûean khǎawng chǎn mák jà luem tho-ra-sàp wái thîi bâan,My friend tends to forget her phone at home.,"[{""thai"":""เพื่อนของฉัน"",""english"":""my friend"",""tone"":""falling""},{""thai"":""มักจะ"",""english"":""tends to"",""tone"":""falling"",""grammar"":true},{""thai"":""ลืม"",""english"":""forget"",""tone"":""mid""},{""thai"":""โทรศัพท์"",""english"":""phone"",""tone"":""mid""},{""thai"":""ไว้ที่บ้าน"",""english"":""at home"",""tone"":""falling""}]",medium
เขามักจะทำอาหารเย็นเอง,khao mák jà tham aa-hǎan yen eeng,He tends to make dinner himself.,"[{""thai"":""เขา"",""english"":""he"",""tone"":""rising""},{""thai"":""มักจะ"",""english"":""tends to"",""tone"":""falling"",""grammar"":true},{""thai"":""ทำอาหารเย็น"",""english"":""make dinner"",""tone"":""mid""},{""thai"":""เอง"",""english"":""himself"",""tone"":""mid""}]",easy
ลูกค้ามักจะถามคำถามเดิม,lûuk-kháa mák jà thǎam kham-thǎam deum,Customers tend to ask the same questions.,"[{""thai"":""ลูกค้า"",""english"":""customers"",""tone"":""falling""},{""thai"":""มักจะ"",""english"":""tend to"",""tone"":""falling"",""grammar"":true},{""thai"":""ถาม"",""english"":""ask"",""tone"":""rising""},{""thai"":""คำถามเดิม"",""english"":""the same questions"",""tone"":""mid""}]",medium
น้องชายฉันมักจะทำการบ้านล่วงหน้า,nóng chai chǎn mák jà tham gaan-bâan lûang nâa,My younger brother tends to do homework in advance.,"[{""thai"":""น้องชายฉัน"",""english"":""my younger brother"",""tone"":""mid""},{""thai"":""มักจะ"",""english"":""tends to"",""tone"":""falling"",""grammar"":true},{""thai"":""ทำการบ้าน"",""english"":""do homework"",""tone"":""mid""},{""thai"":""ล่วงหน้า"",""english"":""in advance"",""tone"":""falling""}]",hard
พี่สาวมักจะฟังเพลงก่อนนอน,phîi sǎao mák jà fang phleeng gàawn nawn,My elder sister tends to listen to music before bed.,"[{""thai"":""พี่สาว"",""english"":""elder sister"",""tone"":""falling""},{""thai"":""มักจะ"",""english"":""tends to"",""tone"":""falling"",""grammar"":true},{""thai"":""ฟังเพลง"",""english"":""listen to music"",""tone"":""mid""},{""thai"":""ก่อนนอน"",""english"":""before bed"",""tone"":""low""}]",easy
ครูมักจะให้การบ้านเยอะ,khruu mák jà hâi gaan-bâan yóe,The teacher tends to give a lot of homework.,"[{""thai"":""ครู"",""english"":""teacher"",""tone"":""mid""},{""thai"":""มักจะ"",""english"":""tends to"",""tone"":""falling"",""grammar"":true},{""thai"":""ให้การบ้าน"",""english"":""give homework"",""tone"":""falling""},{""thai"":""เยอะ"",""english"":""a lot"",""tone"":""high""}]",medium
เจ้านายมักจะประชุมยาว,jâo-naai mák jà bpra-chum yaao,The boss tends to hold long meetings.,"[{""thai"":""เจ้านาย"",""english"":""boss"",""tone"":""falling""},{""thai"":""มักจะ"",""english"":""tends to"",""tone"":""falling"",""grammar"":true},{""thai"":""ประชุม"",""english"":""hold meetings"",""tone"":""mid""},{""thai"":""ยาว"",""english"":""long"",""tone"":""mid""}]",medium
เพื่อนบ้านมักจะเปิดเพลงดัง,phûean bâan mák jà bpèrt phleeng dang,The neighbors tend to play loud music.,"[{""thai"":""เพื่อนบ้าน"",""english"":""neighbors"",""tone"":""falling""},{""thai"":""มักจะ"",""english"":""tends to"",""tone"":""falling"",""grammar"":true},{""thai"":""เปิดเพลง"",""english"":""play music"",""tone"":""mid""},{""thai"":""ดัง"",""english"":""loud"",""tone"":""mid""}]",medium
เขามักจะอ่านหนังสือก่อนนอน,khao mák jà àan năng-sǔe gàawn nawn,He tends to read books before sleeping.,"[{""thai"":""เขา"",""english"":""he"",""tone"":""rising""},{""thai"":""มักจะ"",""english"":""tends to"",""tone"":""falling"",""grammar"":true},{""thai"":""อ่านหนังสือ"",""english"":""read books"",""tone"":""low""},{""thai"":""ก่อนนอน"",""english"":""before sleeping"",""tone"":""low""}]",easy
เธอมักจะลืมกุญแจ,thoe mák jà luem gun-jae,She tends to forget her keys.,"[{""thai"":""เธอ"",""english"":""she"",""tone"":""mid""},{""thai"":""มักจะ"",""english"":""tends to"",""tone"":""falling"",""grammar"":true},{""thai"":""ลืม"",""english"":""forget"",""tone"":""mid""},{""thai"":""กุญแจ"",""english"":""keys"",""tone"":""mid""}]",easy
พวกเขามักจะเดินทางตอนเย็น,phûak khao mák jà dern thaang tawn yen,They tend to travel in the evening.,"[{""thai"":""พวกเขา"",""english"":""they"",""tone"":""falling""},{""thai"":""มักจะ"",""english"":""tend to"",""tone"":""falling"",""grammar"":true},{""thai"":""เดินทาง"",""english"":""travel"",""tone"":""mid""},{""thai"":""ตอนเย็น"",""english"":""in the evening"",""tone"":""mid""}]",medium
เขามักจะล้างรถในวันเสาร์,khao mák jà láang rót nai wan sǎo,He tends to wash the car on Saturdays.,"[{""thai"":""เขา"",""english"":""he"",""tone"":""rising""},{""thai"":""มักจะ"",""english"":""tends to"",""tone"":""falling"",""grammar"":true},{""thai"":""ล้างรถ"",""english"":""wash the car"",""tone"":""high""},{""thai"":""ในวันเสาร์"",""english"":""on Saturdays"",""tone"":""rising""}]",medium
เพื่อนฉันมักจะซื้อกาแฟมาก่อนทำงาน,phûean chǎn mák jà sǔue gaa-faae maa gàawn tham-ngaan,My friend tends to buy coffee before work.,"[{""thai"":""เพื่อนฉัน"",""english"":""my friend"",""tone"":""falling""},{""thai"":""มักจะ"",""english"":""tends to"",""tone"":""falling"",""grammar"":true},{""thai"":""ซื้อกาแฟมา"",""english"":""buy coffee"",""tone"":""rising""},{""thai"":""ก่อนทำงาน"",""english"":""before work"",""tone"":""low""}]",hard
คุณพ่อมักจะว่ายน้ำวันอาทิตย์,khun phôr mák jà wâai náam wan aa-thít,Dad tends to swim on Sundays.,"[{""thai"":""คุณพ่อ"",""english"":""dad"",""tone"":""mid""},{""thai"":""มักจะ"",""english"":""tends to"",""tone"":""falling"",""grammar"":true},{""thai"":""ว่ายน้ำ"",""english"":""swim"",""tone"":""falling""},{""thai"":""วันอาทิตย์"",""english"":""on Sundays"",""tone"":""mid""}]",easy
หล่อนมักจะกินข้าวเช้ากับครอบครัว,lòn mák jà gin khâao cháo gàp khrôob-khrua,She tends to have breakfast with her family.,"[{""thai"":""หล่อน"",""english"":""she"",""tone"":""low""},{""thai"":""มักจะ"",""english"":""tends to"",""tone"":""falling"",""grammar"":true},{""thai"":""กินข้าวเช้า"",""english"":""have breakfast"",""tone"":""falling""},{""thai"":""กับครอบครัว"",""english"":""with her family"",""tone"":""low""}]",medium
พวกเราไม่มักจะไปชายหาด,phûak rao mâi mák jà pai chaai hàat,We don't tend to go to the beach.,"[{""thai"":""พวกเรา"",""english"":""we"",""tone"":""falling""},{""thai"":""ไม่"",""english"":""don't"",""tone"":""falling""},{""thai"":""มักจะ"",""english"":""tend to"",""tone"":""falling"",""grammar"":true},{""thai"":""ไปชายหาด"",""english"":""go to the beach"",""tone"":""mid""}]",hard
หมอมักจะมาตรวจคนไข้เช้ามาก,mǒr mák jà maa trùat khon khâi cháo mâak,The doctor tends to check on patients very early.,"[{""thai"":""หมอ"",""english"":""the doctor"",""tone"":""rising""},{""thai"":""มักจะ"",""english"":""tends to"",""tone"":""falling"",""grammar"":true},{""thai"":""มาตรวจ"",""english"":""check on"",""tone"":""mid""},{""thai"":""คนไข้"",""english"":""patients"",""tone"":""falling""},{""thai"":""เช้ามาก"",""english"":""very early"",""tone"":""high""}]",hard
ร้านอาหารมักจะปิดเร็ววันจันทร์,ráan aa-hǎan mák jà bpìt reo wan jan,The restaurant tends to close early on Mondays.,"[{""thai"":""ร้านอาหาร"",""english"":""the restaurant"",""tone"":""high""},{""thai"":""มักจะ"",""english"":""tends to"",""tone"":""falling"",""grammar"":true},{""thai"":""ปิดเร็ว"",""english"":""close early"",""tone"":""low""},{""thai"":""วันจันทร์"",""english"":""on Mondays"",""tone"":""mid""}]",hard
นักเรียนมักจะลืมทำการบ้าน,nák rian mák jà luem tham gaan-bâan,Students tend to forget to do homework.,"[{""thai"":""นักเรียน"",""english"":""students"",""tone"":""high""},{""thai"":""มักจะ"",""english"":""tend to"",""tone"":""falling"",""grammar"":true},{""thai"":""ลืม"",""english"":""forget"",""tone"":""mid""},{""thai"":""ทำการบ้าน"",""english"":""to do homework"",""tone"":""mid""}]",medium
ลูกสาวมักจะฝึกเปียโนตอนบ่าย,lûuk sǎao mák jà fùek bpee-a-noo tawn bàai,My daughter tends to practice piano in the afternoon.,"[{""thai"":""ลูกสาว"",""english"":""my daughter"",""tone"":""falling""},{""thai"":""มักจะ"",""english"":""tends to"",""tone"":""falling"",""grammar"":true},{""thai"":""ฝึกเปียโน"",""english"":""practice piano"",""tone"":""low""},{""thai"":""ตอนบ่าย"",""english"":""in the afternoon"",""tone"":""low""}]",medium
ผู้จัดการมักจะออกจากออฟฟิศช้า,phûu jàt gaan mák jà àwk jàak ôf-fít châa,The manager tends to leave the office late.,"[{""thai"":""ผู้จัดการ"",""english"":""the manager"",""tone"":""falling""},{""thai"":""มักจะ"",""english"":""tends to"",""tone"":""falling"",""grammar"":true},{""thai"":""ออกจาก"",""english"":""leave"",""tone"":""falling""},{""thai"":""ออฟฟิศ"",""english"":""the office"",""tone"":""falling""},{""thai"":""ช้า"",""english"":""late"",""tone"":""high""}]",hard
พนักงานใหม่มักจะขอคำแนะนำจากเพื่อนร่วมงาน,pha-nák-ngaan mài mák jà khǎaw kham-nae-nam jàak phûean-rûam-ngaan,New employees tend to ask for advice from colleagues.,"[{""thai"":""พนักงานใหม่"",""english"":""New employees"",""tone"":""mid""},{""thai"":""มักจะ"",""english"":""tend to"",""tone"":""high"",""grammar"":true},{""thai"":""ขอ"",""english"":""ask for"",""tone"":""rising""},{""thai"":""คำแนะนำ"",""english"":""advice"",""tone"":""high""},{""thai"":""จาก"",""english"":""from"",""tone"":""low""},{""thai"":""เพื่อนร่วมงาน"",""english"":""colleagues"",""tone"":""falling""}]",medium